codigo,ean,stock,precio,promo,descripcion
20,70942003315,2,7311.0,No Promo,GUM PAW PATROL +3 LUZ 202 CEPILLO DENTAL 1 U IDAD
20,71249410554,2,18684.000000000004,No Promo,LOREAL BRILLANT EYES DIAMOND DROP 415
20,71249650097,2,21636.0,No Promo,LOREAL PARADISE GLOSS BLISSFUL BLUSH
20,71249650172,2,21636.0,No Promo,LOREAL PARADISE GLOSS ROSY UTOPIA
20,71249672907,2,30174.0,No Promo,LOREAL TELESCOPIC LIFT WSH MASCARA PESTANA 9 1
20,71249681008,2,30174.0,No Promo,LOREAL PARIS PANORAMA MASCARA DE PESTANA BLA K WTX
20,73796714222,2,165551.0,No Promo,OMRON TENSIOMETRO AUTOMATICO HEM 7142
20,73796714420,2,165551.0,No Promo,OMRON TENSIOMETRO AUTOMATICO HEM 7144 T2
20,79400103147,2,9061.0,No Promo,DOVE CLINICAL WOM ORIGINAL SOFT BARRA 48GR
20,92626515402,2,1939.0,No Promo,MATANA SONAJERO CAJA
20,309970077921,2,17990.0,No Promo,REVLON PHOTOREADY CONCEALER LIGHT 002
20,309970101428,2,19190.0,20%,REVLON COLORSTAY CREME EYE SHADOW x1u 710(CARAMEL)
20,309970166373,2,23290.0,No Promo,REVLON COLORSTAY LINE CREATOR LEATHERCRAFT 1 2
20,309970174866,2,18290.0,No Promo,REVLON COLORSTAY SEMI PERMANENTE BROW INK 35 SOFT
20,309970187170,2,18290.0,No Promo,REVLON LAPIZ LABIAL CS SUEDE INK LIPSTICK  T NNEL VISION  010
20,309970187224,2,16490.0,No Promo,REVLON COLORSTAY SUEDE INK LIPSTICK LIP BOOM LAPIZ LABIAL 015
20,309970193935,2,22900.0,20%,REVLON PHOTOREADY PRIME PLUS MATTIFYING+ POR REDUCING
20,309970215767,2,20190.0,No Promo,REVLON COLORSTAY LIMITLESS MATTE LIQUID LABI L LIQUIDO 002
20,309970215774,2,20190.0,No Promo,REVLON COLORSTAY LIMITLESS MATTE LIQUID LABI L LIQUIDO 003
20,309970215781,2,20190.0,No Promo,REVLON COLORSTAY LIMITLESS MATTE LIQUID LABI L LIQUIDO 004
20,309970215880,2,20190.0,No Promo,REVLON COLORSTAY LIMITLESS MATTE LIQUID LABI L LIQUIDO 014
20,309971879104,2,12290.0,No Promo,REVLON KISS BALM lab.x1u010(COCONUT)
20,309971879203,2,12290.0,No Promo,REVLON KISS BALM lab.x1u025(STRAWBERRY)
20,309973212022,2,17990.0,No Promo,REVLON PHOTOREADY CONCEALER LIGHT 002
20,309976047034,2,18990.0,No Promo,REVLON COLORSTAY pvo.830 x84gr (MEDIUM LIGHT
20,650240004643,2,3897.0,No Promo,ASEPXIA Exfoliante HF jab.x 100g
20,650240007828,2,3897.0,No Promo,ASEPXIA Azufre HF jab.x 100 g
20,650240035401,2,4842.0,No Promo,ASEPXIA CarbŃn jab.x 100 g
20,652217397086,2,74690.0,No Promo,MAVERICK ALMOHADILLA HP301 SUPER ACOGEDORA
20,652217407549,2,36135.0,10%,MAVERICK PLANCHITA DE PELO - BP35
20,652217529425,2,74584.0,20%,MAVERICK NEBULIZADOR MINI A PISTON 405B
20,652217904321,2,64350.0,No Promo,MAVERICK CORTADORA DE PELO - BEA0100
20,736372523655,2,5400.0,No Promo,LAIMA ESMALTE BABY ROSE 45
20,736372523709,2,5400.0,No Promo,LAIMA ESMATE SEAFOAM 50
20,736372524560,2,2990.0,25%,DARVITA LAIMA QUITAESMALTE SUAVIZANTE CON AC ITE DE ALMENDRAS 60ML
20,742832916622,2,1939.0,No Promo,MATANA SONAJERO CAJA
20,3014260273903,2,9001.0,No Promo,GILLETTE FOAMY REGULAR ESPUMA 312GR
20,3014260273910,2,9001.0,No Promo,GILLETTE FOAMY SENSITIVE ESPUMA 312GR
20,3337871311346,2,36000.0,No Promo,VICHY DERCOS OIL CONTROL SEBO-CORRECTOUR SHA POO 200ML
20,3337872414039,2,101455.0,No Promo,LRP REDERMIC R OJOS pomo x15ml
20,3337875525947,2,136315.0,No Promo,VICHY DERCOS AMINEXIL CLINICAL 5 WOM amp.x12 x6ml c/u
20,3337875537308,2,32045.0,No Promo,LA ROCHE POSAY LIPIKAR SYNDET AP+ LIQUED 200 L - LR127
20,3337875549615,2,67955.0,No Promo,LA ROCHE POSAY LIPIKAR LECHE CORPORAL SIN PE FUME CREMA 400ML
20,3337875574358,2,39015.0,No Promo,VICHY DERCOS DENSIJSOLUTIONS SH x250ml
20,3337875597395,2,38435.0,No Promo,CERAVE LOCIËN HIDRAT. 473 ML
20,3337875598071,2,59685.0,No Promo,LA ROCHE POSAY EFFACLAR DUO[+] APF POMO 40ML - LR147
20,3337875660549,2,103625.0,No Promo,LRP REDERMIC R pomo x30ml
20,3337875673914,2,44935.0,No Promo,VICHY DERCOS KERA SOLUTIONS MASCARA 200ML
20,3337875678094,2,38120.0,No Promo,VICHY DERCOS ESTIMULANTE AC.FORTIFICANTE X 2 0ML
20,3337875696548,2,79565.0,No Promo,LRP LIPIKAR BAUME AP x400ml
20,3337875706674,2,41645.0,No Promo,LRP ANTHELIOS MINERAL ONE FPS50+ TONO 02
20,3337875708265,2,48330.0,No Promo,LA ROCHE POSAY EFFACLAR GEL MICROEXFOLIANTE 00ML - LR251
20,3337875728188,2,79565.0,No Promo,LRP LIPIKAR BAUME AP x400ml
20,3337875763790,2,57375.0,No Promo,LA ROCHE POSAY LIPIKAR BAUME AP+M POMO 200ML -LR267
20,3337875774031,2,95370.0,No Promo,VICHY NEOVADIOL POST MENOPAUSIA DIA X50
20,3337875774161,2,91245.0,No Promo,VICHY NEOVADIOL PERI MENOPAUSIA DIA PSX50
20,3337875863377,2,59685.0,No Promo,LA ROCHE POSAY EFFACLAR DUO[+] APF POMO 40ML - LR147
20,3337875874366,2,36000.0,No Promo,VICHY DERCOS OIL CONTROL SEBO-CORRECTOUR SHA POO 200ML
20,3401560936988,2,42780.0,No Promo,BIODERMA ATODERM INT GEL MOUSSANT gel x 200 l
20,3466320012838,2,41525.0,No Promo,CETAPHIL HUMECTANT cr.x 453 g
20,3499320005326,2,13456.0,No Promo,CETAPHIL Toallitas x 25
20,3577056021695,2,19851.0,No Promo,ELUDRIL CARE sol.x 500 ml
20,3600522862383,2,34404.0,30%,LOREAL THE FUNDATION TRUE MATCH FLUIDA N1 (I ORE)
20,3600522862567,2,34404.0,30%,LOREAL TRUE MATCH FDT  5.D/5.W
20,3600523500192,2,23588.0,30%,LOREAL THE FUNDATION TRUE MATCH CORRECTOR x6.8ml2N(VAINILLA)
20,3600523560813,2,27036.0,No Promo,LOREAL OA PARADISE BLUSH 01 PEACH
20,3600523560837,2,27036.0,No Promo,LOREAL BACK TO BRONZE POWDER 02(SUNKISS)
20,3600523919284,2,25913.0,30%,LOREAL OA TRUE MATCH CONCERT 3-5N
20,3600523989911,2,36126.0,No Promo,LOREAL OA TRUE MATCH SERUM 3-4 ENG
20,3600524026684,2,22305.0,No Promo,LOREAL INFALLIBLE GEL AUTO LINER ELECTRIC BL E 260
20,3600530730308,2,20631.0,No Promo,MAYBELLINE HYPER PRECISSE ALL DAY eyeliner700(BLACK)
20,3600531531133,2,17813.0,No Promo,MAYBELLINE TATTO LINER PENCIL  921 DEEP TEAL
20,3607345379036,2,32742.0,No Promo,RIMMEL LASTING FINISH END x30ml 100 (IVORY)
20,3607345379050,2,32742.0,50%,rimmel Lastng finish 25h foundation 200
20,3614220077611,2,18766.0,No Promo,RIMMEL OH MY GLOSS LOVE BUG  LABIAL 100
20,3614220077673,2,18766.0,No Promo,RIMMEL OH MY GLOSS STAY MY ROSE LABIAL 160
20,3614220077796,2,18766.0,No Promo,RIMMEL OH MY GLOSS CLEAR LABIAL 800
20,3614226493651,2,27250.0,No Promo,RIMMEL LASTING RADIANCE FDT ANTIPOLLUTION env.x30ml100(IVORY)
20,3614226493675,2,27250.0,No Promo,RIMMEL LASTING RADIANCE FDT ANTIPOLLUTION env.x30ml200(SOFTBEIGE)
20,3616300776223,2,20549.000000000004,No Promo,RIMMEL OH MY GLOSS PLUMP 211
20,3616300776230,2,20549.000000000004,No Promo,RIMMEL OH MY GLOSS PLUMP  759
20,3616301236078,2,32742.0,50%,rimmel lasting finish 25h 500
20,3616303011246,2,28409.0,No Promo,RIMMEL LASTING COMPACT 05
20,3616303415471,2,7050.0,No Promo,SALLY HANSEN ESMALTE INSTA DRI LATER ALLIGAT R 529
20,3616305499844,2,19504.000000000004,No Promo,RIMMEL STAY GLOSSY LIP OIL BRILLO LABIAL 001
20,3616305499875,2,19504.000000000004,No Promo,RIMMEL STAY GLOSS LIP OIL BRILLO LABIAL 004
20,4001638088039,2,33000.0,No Promo,WELEDA ACEITES CORPORALES Abedul p/celul.ac. 100ml
20,4001638088183,2,28000.0,No Promo,"WELEDA CALENDULA (BEBES,N,PIEL SENS.) leche orp.x 200 ml"
20,4001638095112,2,30000.0,No Promo,WELEDA ACEITES CORPORALES Aceite p/embarazo 100ml
20,4001638096515,2,18000.0,No Promo,WELEDA GEL CREMOSO DE DUCHA Calndula x 200 m
20,4001638096539,2,28000.0,No Promo,"WELEDA CALENDULA (BEBES,N,PIEL SENS.) leche orp.x 200 ml"
20,4001638099202,2,28000.0,No Promo,WELEDA ACEITES CORPORALES Arnica aceite x 50 ml
20,4001638099226,2,30000.0,No Promo,WELEDA ACEITES CORPORALES Arnica aceite x 10 ml
20,4001638099295,2,30000.0,No Promo,WELEDA ACEITES CORPORALES Calndula aceite x 00ml
20,4001638099394,2,32000.0,No Promo,WELEDA ACEITES CORPORALES Rosa mosqueta ac.x 100ml
20,4001638526708,2,33000.0,No Promo,WELEDA SKIN FOOD BODY BUTTER x150ml
20,4001638529426,2,29000.0,No Promo,WELEDA LECHES CORPORALES Skin Food x 200 ml
20,4005800024023,2,96033.0,No Promo,EUCERIN HYALURON FILLER NOCHE cr.x50ml
20,4005800024139,2,47937.0,No Promo,EUCERIN UREA 10% INTENSIVA COMPLETE REPAIR l c.x250ml
20,4005800036842,2,28210.0,No Promo,EUCERIN DERMOCAPILLARE SH x250ml (CASPA GRAS )
20,4005800057670,2,89717.0,No Promo,EUCERIN HYALURON FILLER OJOS cr.x15ml
20,4005800109249,2,74199.0,No Promo,EUCERIN ANTIENROJECIMIENTO PS FPS25 cr.x50ml
20,4005800128608,2,58452.0,No Promo,EUCERIN AQUAPHORIN ACTIVE HIDRAT.PNM cr.x50g
20,4005800131189,2,58452.0,No Promo,EUCERIN AQUAPHORIN ACTIVE HIDRAT.PNM cr.x50g
20,4005800150135,2,53082.0,No Promo,EUCERIN DERMATOCLEAN LIMPIADORA 3EN1 loc.x40 ml
20,4005800180514,2,31719.0,No Promo,EUCERIN DERMOPURE OIL AGUA MICELAR env.x200m
20,4005800193279,2,91401.00000000001,No Promo,EUCERIN HYALURON FILLER +VOL.LIFT DIA PS cr. 50ml
20,4005800223136,2,41779.0,No Promo,EUCERIN AQUAPHORIN ACTIVE UNGUENTO REPARADOR unguento x50g
20,4005800270468,2,53082.0,No Promo,EUCERIN DERMATOCLEAN LIMPIADORA 3EN1 loc.x40 ml
20,4005800287855,2,49869.0,No Promo,EUCERIN UREA REPAIR PLUS PIES LOCION  X 150M
20,4005800327568,2,89717.0,No Promo,EUCERIN VOLUME FILLER ANTI EDAD FPS15 OJOS 1 ML
20,4005800630955,2,25417.0,No Promo,EUCERIN INTIMATE HYGIENE WASH PROTECTION flu do x250ml
20,4005800630958,2,25417.0,No Promo,EUCERIN INTIMATE HYGIENE WASH PROTECTION flu do x250ml
20,4005808321216,2,6459.0,No Promo,NIVEA SOFT BODY MILK 5EN1 PIEL SECA CREMA CO PORAL 250ML
20,4005808515592,2,7199.0,No Promo,NIVEA SOFT cr.x200gr (en pote)
20,4005808547760,2,11784.0,No Promo,NIVEA VISAGE HIDRATANTE ACTIVA DIA cr.x50ml PNM)
20,4005808583348,2,40422.0,No Promo,EUCERIN DERMATOCLEAN PIEL SENSIBLE GEL DE LI PIEZA 200ML
20,4005900399953,2,10083.0,40%,NIVEA BODY LOC.COPORAL CEREZA loc.x400ml
20,4005900436979,2,60165.0,No Promo,EUCERIN DERMOPURE OIL FAC.ACCION INT.NOCHE c .x40g
20,4005900436986,2,42847.0,No Promo,EUCERIN DERMOPURE OIL GEL LIMPIEZA gel x200m
20,4005900436993,2,45291.0,No Promo,EUCERIN DERMOPURE OIL EXFOLIANTE cr.x100g
20,4005900490445,2,91401.00000000001,No Promo,EUCERIN HYALURON FILLER +VOL.LIFT DIA PS cr. 50ml
20,4005900490483,2,96033.0,No Promo,EUCERIN HYALURON - FILLER + VOL - LIFT NOCHE CREMA 50GR
20,4005900490490,2,89717.0,No Promo,EUCERIN VOLUME FILLER ANTI EDAD FPS15 OJOS 1 ML
20,4005900517005,2,2348.0000000000005,25%,NIVEA FRESH ICE MEN DESO.ROLL-ON x150ml
20,4005900559500,2,92032.0,No Promo,EUCERIN ANTIPIGMENTO DIA FPS30 cr.x50ml
20,4005900650412,2,93795.0,No Promo,EUCERIN HYALURON FILLER ANTIEDAD +ELAST.OJOS env.x15ml
20,4005900667014,2,13962.0,No Promo,EUCERIN HYALURON FILLER MASCARILLA INTENSIVA
20,4005900728807,2,105111.0,No Promo,eucerin Hyalluron filler+Elasticity FP30
20,4005900773821,2,13641.0,60%,NIVEA ROSE AGUA MICELAR BIFAS LOC x  400ML
20,4005900773845,2,10936.0,50%,NIVEA ROSE LECHE Y TONICO MICELAR LOC X 200M
20,4005900838841,2,43576.0,No Promo,EUCERIN ANTIPIGMENT CREMA MANOS X75ML
20,4005900873347,2,70049.0,No Promo,EUCERIN DERMO PURE OIL CONTROL 40ML SERUM
20,4005900902900,2,4234.0,No Promo,NIVEA MANTECA DE KARITE CREMA CORPORAL 250ML
20,4005900903273,2,96658.0,No Promo,EUCERIN ANTI-PIGMENT ULTRA-LIGHT SERUM X30 M
20,4005900951526,2,33117.0,No Promo,EUCERIN PH5 LIGHT GEL CREAM x200ml
20,4005900985156,2,4234.0,No Promo,NIVEA MANTECA DE KARITE CREMA CORPORAL 250ML
20,4005900991058,2,86425.0,No Promo,EUCERIN HYALURON FILLER 3X EFFECT NOCHE CREM FACIAL REFILL 50ML
20,4006000040417,2,6459.0,No Promo,NIVEA SOFT BODY MILK 5EN1 PIEL SECA CREMA CO PORAL 250ML
20,4006000050188,2,3609.0,No Promo,NIVEA CREME CARE JABON 125GR 3U
20,4006000050461,2,3609.0,No Promo,NIVEA ANTIBACTERIAL 3EN1 JABON 3UNIDADES 90G
20,4580193650870,2,55284.0,No Promo,SILFAB TENSIËMETRO DIGITAL AUTOM-TICO DE MUĐ CA 99 MEMORIAS CON INDIC
20,4580193651440,2,90680.0,No Promo,CITIZEN TENSIOMETRO DIG.AUTOMATICO    c/MANG GDE CH305
20,4895125910176,2,15128.0,No Promo,BASICCARE MANICURA KIT x1u ART.1017
20,4895125912460,2,6400.0,No Promo,BASICC 1246 MAQ.AFEITAR P/CEJA
20,4895125916239,2,8316.0,No Promo,BASICC 1623 REMOVEDOR DE PUNTOS NEGROS
20,4895125932161,2,6023.0,No Promo,BASICCARE PEINE MULTIPROPOSITO x1u ART.3216
20,5012874101009,2,20453.0,2x1,RIMMEL DELINEADOR DE OJOS EXAGGERATE LIQ. BL CK 001 (0111096001)
20,5012909006941,2,17599.0,No Promo,AVENT DISPENSER p/LECHE EN POLVO caja x1u 13 /06
20,6001159129158,2,14062.0,No Promo,BIO OIL BODY LOTION HIDRATANTE X175ML
20,6902395806493,2,29010.0,No Promo,MAYBELLINE FIT ME ULTMT TWC SPF 220 ASJP
20,6902395825272,2,18237.0,No Promo,MAYBELLINE TATTO BROW 3D STYLING GEL MEDIUM ROWN 6ML
20,6902395830559,2,26015.0,No Promo,MAYBELLINE FIT ME FRESH TINT SPF50 BASE LIQU DA 6
20,6902395830566,2,26015.0,35%,MAYBELLINE FIT ME FRESH TINT SPF50 BASE LIQU DA 7
20,6902395830573,2,26015.0,35%,MAYBELLINE FIT ME FRESH TINT SPF50 BASE LIQU DA 8
20,7500435012195,2,4098.0,No Promo,PANTENE PRO-V MIRACLES BRILLO EXTREMO ACONDI IONADOR 200ML
20,7500435012225,2,7144.0,No Promo,PANTENE PRO-V MIRACLES BRILLO EXTREMO ACONDI IONADOR 400ML
20,7500435012317,2,7144.0,No Promo,PANTENE PRO-V RIZOS DEFINIDOS SHAMPOO 400ML
20,7500435019880,2,10608.0,25%,H&S MANZANA FRESH SH x375ml
20,7500435122764,2,4497.0,No Promo,ORAL B COMPLETE 4EN1 CREMA DENTAL 70GR
20,7500435147194,2,8545.0,No Promo,ORAL B 3D WHITE MINERAL CLEAN CARBON ACTIVAD CREMA DENTAL 102GR
20,7500435147569,2,8455.0,No Promo,HEAD & SHOULDERS MANZANA FRESH  ACONDICIONAD R 300ML
20,7500435168106,2,4098.0,No Promo,PANTENE PRO-V MIRACLES BRILLO EXTREMO ACONDI IONADOR 200ML
20,7500435168113,2,7144.0,No Promo,PANTENE PRO-V MIRACLES BRILLO EXTREMO ACONDI IONADOR 400ML
20,7500435170840,2,7144.0,No Promo,PANTENE PRO-V RIZOS DEFINIDOS SHAMPOO 400ML
20,7500435176071,2,7144.0,No Promo,PANTENE PRO-V MIRACLES BRILLO EXTREMO ACONDI IONADOR 400ML
20,7500435176200,2,4098.0,No Promo,PANTENE PRO-V MIRACLES BRILLO EXTREMO ACONDI IONADOR 200ML
20,7500435176989,2,11012.000000000002,No Promo,ORAL B EXTRA BLANCO CON BICARBONATO  CREMA D NTAL X 180G
20,7500435177030,2,6802.0,No Promo,ORAL B 3D WHITE BRILLIANT FRESH CREMA DENTAL 70GR
20,7500435178631,2,11051.0,25%,GILLETTE MACH3 CUERPO MAQUINA AFEITAR 1 UNID D
20,7500435190473,2,23838.0,No Promo,GILLETTE FUSION 5 PROSHIELD MAQUINA 1UNIDAD
20,7500435191524,2,6974.0,No Promo,PANTENE TRATAMIENTO COLAGENO SELLADOR DE PUN AS SERUM 90ML
20,7500435191548,2,7414.0,No Promo,PANTENE PRO-V MIRACLES COLAGENO CREMA PARA P INAR 300ML
20,7500435191937,2,10608.0,25%,H&S MANZANA FRESH SH x375ml
20,7500435206587,2,10608.0,25%,H&S MANZANA FRESH SH x375ml
20,7500435212113,2,7144.0,No Promo,PANTENE PRO-V RIZOS DEFINIDOS SHAMPOO 400ML
20,7500435212212,2,4098.0,No Promo,PANTENE PRO-V MIRACLES BRILLO EXTREMO ACONDI IONADOR 200ML
20,7500435212229,2,7144.0,No Promo,PANTENE PRO-V MIRACLES BRILLO EXTREMO ACONDI IONADOR 400ML
20,7500435219112,2,5209.0,No Promo,ALWAYS COMFORT  FINA SUAVE C/ALAS DIA TOA X 6UNI
20,7500435219655,2,9001.0,No Promo,GILLETTE FOAMY SENSITIVE ESPUMA 312GR
20,7500435224604,2,9001.0,No Promo,GILLETTE FOAMY REGULAR ESPUMA 312GR
20,7500435237536,2,51532.0,No Promo,PAMPERS DELUXE PROTECTION M 72 UNIDADES
20,7501054550211,2,96734.0,No Promo,EUCERIN HYALURON-FILLER PORE MINIMIZER SERUM 30ML
20,7506195131640,2,4497.0,No Promo,ORAL B COMPLETE 4EN1 CREMA DENTAL 70GR
20,7506295388487,2,6802.0,No Promo,ORAL B 3D WHITE BRILLIANT FRESH CREMA DENTAL 70GR
20,7506306215740,2,5740.0,No Promo,DOVE MATCHA cr.x400ml
20,7506306252868,2,14518.0,30%,DOVE PRO-CERAMIDAS PIEL SECA CORPORAL SERUM 00ML
20,7506339390230,2,6816.0,No Promo,OLD SPICE LEĄA DESO.BARRA x50gr
20,7506460101057,2,7422.0,No Promo,VEET KIT DEPILACION FACIAL CREMA 2U PIEL NOR AL 50ML
20,7509546070285,2,2474.0,No Promo,COLGATE SMILES BARBIE +6A PACKS 2X1 CEPILLO ENTAL 2 UNIDADES
20,7509546664781,2,5203.0,No Promo,COLGATE 360 ANTIBACTERIAL SUAVE 2X1 CEPILLO ENTAL 2 UNIDADES
20,7509546671550,2,3959.0,No Promo,COLGATE SENSITIVE PRO ALIVIO INMEDIATO ENCIA CREMA DENTAL 90GR
20,7509552791396,2,4238.0,40%,ELVIVE ARCILLA EXTRAORDINARIA ACONDICIONADOR 200ML
20,7509552791426,2,4238.0,40%,ELVIVE KERA LISO NUTRI LISS ACONDICIONADOR 2 0ML
20,7509552791853,2,5545.0,No Promo,ELVIVE KERA LISO MASCARILLA CAPILAR PERFECCI NADORA 300GR
20,7509552792546,2,4238.0,40%,ELVIVE KERA LISO NUTRI LISS SHAMPOO 200ML
20,7509552800371,2,4238.0,40%,ELVIVE ARCILLA EXTRAORDINARIA ACONDICIONADOR 200ML
20,7509552816099,2,5545.0,No Promo,ELVIVE COLOR VIVE MASCARILLA PROTECTORA CREM 300ML
20,7509552823806,2,4403.0,30%,GARNIER FRUCTIS GOODBYE DANOS SHAMPOO 350ML
20,7509552836585,2,4238.0,40%,ELVIVE DREAM LONG SHAMPOO 200ML
20,7509552838879,2,4238.0,40%,ELVIVE DREAM LONG SHAMPOO 200ML
20,7509552843071,2,4238.0,40%,ELVIVE DREAM LONG LISS SHAMPOO 200ML
20,7509552843101,2,4238.0,40%,ELVIVE DREAM LONG LISS ACONDICIONADOR 200ML
20,7509552849523,2,5922.0,No Promo,GARNIER FRUCTIS HAIR FOOD SANDIA MASCARILLA EVITALIZANTE 350ML
20,7509552874006,2,5922.0,No Promo,GARNIER FRUCTIS HAIR FOOD SANDIA MASCARILLA EVITALIZANTE 350ML
20,7509552874198,2,9300.0,No Promo,GARNIER SKIN ACTIVE EXPRESS ACLARA ANTI IMPE FECCIONES 2% CREMA 142GR
20,7509552875416,2,11555.0,No Promo,GARNIER SKIN ACTIVE EXPRESS AGUA MICELAR ACI O SALICILICO 400ML
20,7509552875461,2,25800.0,30%,GARNIER SKIN ACTIVE EXPRESS ACLARA ANTI ACNE 4% SERUM 30ML
20,7509552875638,2,12818.0,No Promo,VOGUE BASE POLVO RESIST 12HS BRONCE 9GR
20,7509552884500,2,10199.0,No Promo,VOGUE COLORISSIMO FRUTAL FRAMBUESA LABIAL LI UIDO 5ML
20,7509552884524,2,10199.0,No Promo,VOGUE COLORISSIMO FRUTAL FRUTILLA LABIAL LIQ IDO 5ML
20,7509552884531,2,10199.0,No Promo,VOGUE COLORISSIMO FRUTAL SANDIA LABIAL LIQUI O 5ML
20,7509552902839,2,4238.0,40%,ELVIVE KERA LISO NUTRI LISS SHAMPOO 200ML
20,7509552902853,2,4238.0,40%,ELVIVE KERA LISO NUTRI LISS ACONDICIONADOR 2 0ML
20,7509552902921,2,5545.0,No Promo,ELVIVE COLOR VIVE MASCARILLA PROTECTORA CREM 300ML
20,7509552908701,2,4403.0,30%,GARNIER FRUCTIS GOODBYE DANOS SHAMPOO 350ML
20,7509552911992,2,14775.0,No Promo,LOREAL WRINKLER EXPERT +35 cr.x50gr
20,7611916124501,2,21100.0,No Promo,WELEDA GEL DE DUCHA CITRUS REFRESH 200ML
20,7702003010781,2,1810.0,No Promo,CURITAS APOSITOS Transpiel apos.x 20
20,7702003469299,2,1810.0,No Promo,CURITAS APOSITOS Transpiel apos.x 20
20,7702018382323,2,23838.0,No Promo,GILLETTE FUSION 5 PROSHIELD MAQUINA 1UNIDAD
20,7702031310914,2,12000.0,No Promo,NEUTROGENA HYDRO BOOST BODY GEL cr.x400ml
20,7790010002578,2,8224.0,No Promo,JOHNSON BABY GOTAS DE BRILLO SHAMPOO 400ML
20,7790010002646,2,5605.0,35%,SIEMPRE LIBRE ADAPT PLUS ULTRA SUAVE CON ALA TOALLA FEMENINA 16 UNID
20,7790010002967,2,8224.0,No Promo,JOHNSON BABY GOTAS DE BRILLO SHAMPOO 400ML
20,7790010540117,2,8224.0,No Promo,JOHNSON BABY GOTAS DE BRILLO SHAMPOO 400ML
20,7790010570787,2,5605.0,35%,SIEMPRE LIBRE ADAPT PLUS ULTRA SUAVE CON ALA TOALLA FEMENINA 16 UNID
20,7790010596602,2,5605.0,35%,SIEMPRE LIBRE ADAPT PLUS ULTRA SUAVE CON ALA TOALLA FEMENINA 16 UNID
20,7790010601979,2,8224.0,No Promo,JOHNSON BABY GOTAS DE BRILLO SHAMPOO 400ML
20,7790064104716,2,3719.0,No Promo,ESTRELLA POTE X 125 UNID HISOPOS
20,7790371000176,2,4738.0,No Promo,VIDOL TALCO CLASICC BOLSA 250GR
20,7790371003337,2,4722.0,No Promo,DE PREAL GEL FIJADOR FUERTE X 250GR
20,7790375001292,2,9034.0,No Promo,BAGOVIT A Emuls.x 120 ml
20,7790375268671,2,27503.0,No Promo,BAGOVIT FACIAL PRO LIFTING Cr.t/tipo piel x 5 g
20,7790375268862,2,27829.0,No Promo,BAGOVIT FACIAL PRO ESTRUCTURA Cr. noche x 55 g
20,7790375269319,2,12631.0,No Promo,BAGOVIT A Emuls.absorc.1min.x170ml
20,7790375269357,2,22368.0,No Promo,BAGOVIT A FacialProBio 50 ml
20,7790396103074,2,9571.0,No Promo,HENO DE PRAVIA COLONIA 500ML
20,7790416066525,2,1550.0,No Promo,CUTEX QUITAESMALTE FORTALECEDOR 50ML
20,7790808034255,2,25599.0,No Promo,ASPEN BALANZA MECANICA COLOR BLANCA BR9706-71(dds225688)
20,7791001003543,2,11030.0,No Promo,BIFERDIL NUTRI c/VIT.E balsamo x400ml
20,7791001003604,2,9952.000000000002,No Promo,BIFERDIL MANZANILLA SH x400ml
20,7791001005011,2,14628.0,No Promo,BIFERDIL RULOS CPP x270ml
20,7791001010657,2,8362.0,No Promo,BIFERDIL RESTAURACION c/ACIDO HIALURONICO ba s.x295ml
20,7791001010848,2,9616.0,No Promo,BIFERDIL EXTRA BRILLO c/ACEITE PALTA SH x295 l
20,7791001011821,2,8249.0,No Promo,BIFERDIL PANTALLA CAPILAR X155ML
20,7791274197178,2,10091.0,No Promo,MATANA AVENGERS TOYS 2D JABON LIQUIDO 300ML P7178
20,7791293021270,2,2444.0,No Promo,LORD CHESELINE EXTRA FIJACION GEL 150GR
20,7791293038773,2,5772.0,40%,DOVE REGENERACION EXTREMA SHAMPOO 400ML
20,7791293040332,2,3309.0,No Promo,DOVE JAB LIQ P/M ANTIBACTERIAL REPx220
20,7791293041223,2,2444.0,No Promo,LORD CHESELINE EXTRA FIJACION GEL 150GR
20,7791293041858,2,2474.0,No Promo,REXONA ANTIBACTERIAL FRESH JABON LIQUIDO REF LL X 200ML
20,7791293042176,2,5772.0,40%,DOVE REGENERACION EXTREMA SHAMPOO 400ML
20,7791293045368,2,5772.0,40%,DOVE REGENERACION EXTREMA SHAMPOO 400ML
20,7791293046150,2,3309.0,No Promo,DOVE JAB LIQ P/M ANTIBACTERIAL REPx220
20,7791293046839,2,4465.0,No Promo,DOVE SUPER FACTOR NUTRIC ACONDICIONADOR 60 X 170ML
20,7791293047171,2,5772.0,40%,DOVE REGENERACION EXTREMA SHAMPOO 400ML
20,7791293049724,2,2931.0,No Promo,SEDAL PREBIOTICOS + BIOTINA SHAMPOO 190ML
20,7791293049755,2,2931.0,No Promo,SEDAL PREBIOTICOS + BIOTINA ACONDICIONADOR 1 0ML
20,7791293050553,2,4535.0,No Promo,SEDAL LISO PERFECTO 300 ML CRE PEI.
20,7791293050652,2,2444.0,No Promo,LORD CHESELINE EXTRA FIJACION GEL 150GR
20,7791293051017,2,7271.0,30%,DOVE BOND INTENSE REPAIR SHAMPOO 400ML
20,7791520004137,2,1736.0,No Promo,VERITAS ACEITES ESENCIALES JBON x120g x1u
20,7791520004144,2,2020.0,No Promo,VERITAS ENERGIZANTE(NARANJA&LIMON) JBON x120 x1u
20,7791600013233,2,18900.0,No Promo,ALLIANCE MEN EPICEE EDT x80ml
20,7791600018016,2,12600.0,No Promo,KEVIN BLACK MEN EDT 60ML
20,7791600024123,2,15900.0,No Promo,CIEL CRYSTAL EDT 80ML
20,7791600030124,2,10400.0,No Promo,CIEL c/VAPORIZADOR EDP x50ml
20,7791600037345,2,3350.0,No Promo,KEVIN DESO.x250ml
20,7791600042042,2,3200.0,No Promo,PAULA AMOR WOM DESODORANTE 123ML
20,7791600049249,2,18200.0,No Promo,PRUNE III EDP x50ml
20,7791600049690,2,18200.0,No Promo,PRUNE IV EDP x50ml
20,7791600057046,2,26500.0,No Promo,PALOMA HERRERA EDP x100ml
20,7791600057152,2,21950.0,No Promo,PALOMA HERRERA EDP x60ml
20,7791600064235,2,12100.0,No Promo,CIEL NUIT EDT 80ML
20,7791600106027,2,26500.0,No Promo,PALOMA HERRERA FANTASY EDP 100ML
20,7791600106133,2,21950.0,No Promo,PALOMA HERRERA FANTASY EDP 60ML
20,7791600152024,2,20900.0,No Promo,CIEL COFRE CIEL WOM EDT + DESODORANTE
20,7791600161323,2,13462.0,No Promo,KEVIN BLACK MEN EDT 100ML + DEO REGALO
20,7791600171254,2,13462.0,No Promo,KEVIN BLACK MEN EDT 100ML + DEO REGALO
20,7791600174439,2,10800.0,No Promo,COLBERT NOIR EDT x90ml
20,7791600296124,2,13462.0,No Promo,KEVIN BLACK MEN EDT 100ML + DEO REGALO
20,7791600311582,2,26500.0,No Promo,PAULA ALEGRIA ESTUCHE EDT 60ML + DEO 123ML
20,7791600360368,2,15900.0,No Promo,SENS NATURAL NEROLI LIMA EDT X  100ML
20,7791600390136,2,20900.0,No Promo,CIEL COFRE CIEL WOM EDT + DESODORANTE
20,7791600397043,2,20900.0,No Promo,CIEL COFRE CIEL WOM EDT + DESODORANTE
20,7791600572037,2,16650.0,No Promo,BROSS LONDON CLASSIC EDT x100ml
20,7791600596354,2,21950.0,No Promo,KEVIN ABSOLUTE EDT 100ML
20,7791600603137,2,15400.0,No Promo,KEVIN SPIRIT EDT x100ml
20,7791600619145,2,11000.0,No Promo,CIEL LOVE EDT X 60ML VAP
20,7792175007054,2,8787.0,No Promo,PLAC OUT gel x 60 g
20,7792175008495,2,14305.0,No Promo,SENSIDENT COLUTORIO fco.x 500 ml
20,7792175010207,2,14353.0,20%,PERPIEL AGUA MICELAR BIF-SICA sol. x 200 ml
20,7792175010238,2,10298.0,20%,PERPIEL AGUA MICELAR sol. x 200 ml
20,7792175010375,2,15322.0,No Promo,FLUORDENT PX ENJUAGUE BUCAL fco.x 500 ml
20,7792640001419,2,6700.0,No Promo,CAPILATIS LINEA BRILLO EXTREMO AC x420ml
20,7792640001976,2,14700.0,No Promo,CAPILATIS NATURAL OIL OLEO x60ml
20,7792640004311,2,10300.0,40%,CAPILATIS SHAMPOO PLEX  350ML
20,7792640007053,2,5900.0,No Promo,CAPILATIS LINEA PROTECCION BRILLO&VOLUMEN SH x400ml
20,7792640007152,2,5900.0,No Promo,CAPILATIS LINEA PROTECCION COLOR DEFENSE SHA POO 420ML
20,7793008016540,2,4808.0,No Promo,ROBY FIJADOR EXTRA FUERTE SPRAY 180ML
20,7793008019053,2,4808.0,No Promo,ROBY FIJADOR EXTRA FUERTE SPRAY 180ML
20,7793487013306,2,17900.0,No Promo,SJ PETIT ENFANT COLONIA MAMA&BEBEX100ML
20,7793487035018,2,8900.0,No Promo,SAINT JULIEN SHAMPOO 0A1 SH x500ml 3501
20,7793742002915,2,19992.0,No Promo,DERMAGLOS F HID F20 P NORMAL CR 70 GR cr.x 7 g
20,7793742003233,2,18071.0,No Promo,DERMAGLOS LINEA SOLAR Post solar gel x 150 g
20,7793742003776,2,31174.0,No Promo,DERMAGLOS LINEA SOLAR FPS 50 spray cont.x170 l
20,7793742004308,2,13580.0,No Promo,BUSHI Pezonera siliconada x 2
20,7793742004353,2,16946.0,No Promo,AVENO acond.cap.x 250 ml
20,7793742004377,2,24666.0,No Promo,AVENO emuls.x 250 ml
20,7793742004858,2,28805.0,No Promo,DERMAGLOS LINEA SOLAR F base T.1 cr. x 10g
20,7793742005053,2,12693.0,No Promo,DERMAGLOS F TONICO HID SPRAY200 ML spray x 2 0 ml
20,7793742005534,2,26759.0,No Promo,AVENO piel norm/sens cr.x 50g
20,7793742008207,2,12874.0,No Promo,DERMAGLOS C M Y U CR HID ESENCIAL X100GR cr. 100 g
20,7793742008214,2,7573.0,No Promo,DERMAGLOS C M Y U CR HID ESENCIAL X50GR cr.x 50 g
20,7793742008238,2,9390.0,No Promo,DERMAGLOS C M Y U HID + REGENERACION X50GR c .x 50 g
20,7793742008313,2,10009.0,No Promo,DERMAGLOS HOMBRES GEL LIMPIEZA GL 100 GR gel x 100 g
20,7793742208522,2,25649.0,No Promo,DERMAGLOS F ULTRA FIRMEZA CONT cr. x 15 g
20,7793742208539,2,28841.0,No Promo,DERMAGLOS F ULTRA FIRMEZA DIA cr. x 50 g
20,7793970100209,2,28018.0,No Promo,BABELITO SUCCIONADOR DE LECHE MANUAL x1u ART 10020
20,7793970121709,2,4837.0,No Promo,BABELITO LIMPIA BIBERON BASICO
20,7793970132415,2,13492.0,No Promo,BABELITO BIBERON TOMASOLITO T1 x120ml 13241
20,7793970136352,2,9689.0,No Promo,BABELITO MAMADERA 150 ML
20,7793970137021,2,26150.0,No Promo,BABELITO BIBERON BOCA ANCHA x250ml 13702
20,7793970141714,2,6646.0,No Promo,BABELITO TETINA SILICONADA x2u ART.14171
20,7793970141721,2,6646.0,No Promo,BABELITO TETINA SILICONADA x2u ART.14172
20,7793970141738,2,8597.0,No Promo,BABELITO TETINA SILICONADA x2u ART.14173
20,7793970143138,2,8249.0,No Promo,BABELITO TETINA SILICONADA BOCA ANCHA x1u T3 ART.14313
20,7793970251017,2,25895.0,No Promo,BABELITO PLATO TERMICO x1u ART.25101
20,7793970308605,2,6258.0,No Promo,BABELITO CHUPETE REDONDO SILIC. 0-3m x1u ART 30860
