codigo,ean,stock,precio,promo,descripcion
20,7790375269692,4,7675.0,No Promo,BAGOVIT CAPILAR PELO LARGO Y S/FRIZZ shampoo x 350 ml
20,7790375269715,4,7675.0,No Promo,BAGOVIT CAPILAR BRILLO SUBLIME acond. x 350 l
20,7790375269760,4,7693.0,No Promo,BAGOVIT CAPILAR NUTRICION PROFUNDA tratamien o capilar x300
20,7790375269777,4,7693.0,No Promo,BAGOVIT CAPILAR REPARACION INTENSIVA tratami nto capilar x300
20,7791001000924,4,12614.0,No Promo,BIF CHAMPU HIPOALERG. x250
20,7791001000986,4,12427.0,No Promo,BIF BRILLO SILIC AERO x290
20,7791001003499,4,10217.000000000002,No Promo,BIF CHAMPU SUPER ESPECIAL x400
20,7791001003581,4,11602.000000000002,No Promo,BIFERDIL BIFERMIX balsamo x400ml
20,7791001003710,4,11455.0,20%,BIFERDIL SEMILLAS DE LINO SH x400ml
20,7791001003727,4,11455.0,No Promo,BIFERDIL SEMILLAS DE LINO bals.x400ml
20,7791001004014,4,9996.0,20%,BIFERDIL ACEITE JOJOBA balsamo x400ml
20,7791001005585,4,7968.0,No Promo,BIFERDIL QUININA balsamo x294ml
20,7791001007930,4,11726.0,No Promo,BIF CHAMPU CASPA CAIDA x295
20,7791001008401,4,16619.0,No Promo,BIFERDIL ALISADO balsamo x295ml
20,7791001008982,4,14631.0,No Promo,BIFERDIL LINEA BIO COLOR 0% AMONIACO champ.s ll.0%amon.x400ml
20,7791001009156,4,10371.0,No Promo,BIFERDIL LINEA LIBRE DE GLUTEN shamp.x 180 g
20,7791001009163,4,10371.0,No Promo,BIFERDIL LINEA LIBRE DE GLUTEN bals.x 180 g
20,7791001009361,4,10215.0,No Promo,BIFERDIL LINEA ORO Y CAVIAR Spray p/peinar x 150 ml
20,7791001009743,4,10407.000000000002,No Promo,BIFERDIL LINEA 100% VEGANO bals.x 200 ml
20,7791001010640,4,8362.0,No Promo,BIFERDIL RESTAURACION c/ACIDO HIALURONICO SH x295ml
20,7791001010879,4,8362.0,No Promo,BIFERDIL EXTRA SUAVE c/ACEITE COCO balsamo x 95ml
20,7791001011036,4,8696.0,25%,COLORACION TONO SOBRE TONO KIT 6
20,7791001011432,4,14323.0,No Promo,BIFERDIL CHAMP+ REFLEJANTE PLATA x 295 ml 78
20,7791001011586,4,8344.0,No Promo,BIFERDIL LINEA NUTRI CON VITAMINA E másc.nut i creamx 150 ml
20,7791001011678,4,11047.000000000002,No Promo,BIFERDIL LINEA ULTRA-BRILLO máscara pote x 1 0 ml
20,7791001011913,4,8528.0,No Promo,BIFERDIL MASC KERATINA VEGETAL
20,7791130819626,4,1669.0,No Promo,ESPADOL DETTOL EXFOLIANTE JABON 80GR X1UNI
20,7791293023175,4,3066.0,35%,REXONA MEN FANATICS DESODORANTE 150ML
20,7791293033075,4,9281.0,No Promo,ST IVES PIEL RENOVADA CREMA CORPORAL 532ML
20,7791293035949,4,2799.0,No Promo,PATRICHS GRAND PRIX DESODORANTE MASCULINO 15 ML
20,7791293037684,4,1845.0,No Promo,LUX ORQUIDEA NEGRA JABON LIQUDO RESPUESTO 22 ML
20,7791293038759,4,5772.0,40%,DOVE AC REGENERACION EXTREMA  X400ml
20,7791293041643,4,3066.0,35%,REXONA MEN FANATICS DESODORANTE 150ML
20,7791293042282,4,5772.0,40%,DOVE AC REGENERACION EXTREMA  X400ml
20,7791293044309,4,1845.0,No Promo,LUX ORQUIDEA NEGRA JABON LIQUDO RESPUESTO 22 ML
20,7791293045085,4,3066.0,35%,REXONA MEN FANATICS DESODORANTE 150ML
20,7791293045207,4,5772.0,40%,DOVE AC REGENERACION EXTREMA  X400ml
20,7791293046815,4,2799.0,No Promo,PATRICHS GRAND PRIX DESODORANTE MASCULINO 15 ML
20,7791293047522,4,5772.0,40%,DOVE AC REGENERACION EXTREMA  X400ml
20,7791293048819,4,1845.0,No Promo,LUX ORQUIDEA NEGRA JABON LIQUDO RESPUESTO 22 ML
20,7791293049472,4,3066.0,35%,REXONA MEN FANATICS DESODORANTE 150ML
20,7791600037567,4,6700.0,No Promo,KEVIN COLONIA col.x170ml
20,7791600045593,4,3200.0,No Promo,PAULA DESO.x123ml
20,7791600060145,4,6850.0,No Promo,CHESTER ICE s/VAPORIZADOR EDT x60ml
20,7791600102296,4,23900.0,No Promo,GINO BOGANI CHIC TO CHEEK! EDP x60ml
20,7791600106577,4,26500.0,No Promo,PALOMA HERRERA ESTUCHE FANTASY EDP 60ML + DE 123ML
20,7791600132163,4,20500.0,No Promo,KEVIN COFRE BLACK MEN EDT 60ML
20,7791600145132,4,20500.0,No Promo,KEVIN COFRE BLACK MEN EDT 60ML
20,7791600162252,4,20500.0,No Promo,KEVIN COFRE BLACK MEN EDT 60ML
20,7791600507121,4,20500.0,No Promo,KEVIN COFRE BLACK MEN EDT 60ML
20,7791600744120,4,20500.0,No Promo,KEVIN COFRE BLACK MEN EDT 60ML
20,7791600962159,4,10400.0,No Promo,CIEL ROSE c/VAPORIZADOR EDT x50ml
20,7791969850661,4,5320.0,No Promo,NIVEA LABELLO SOFT ROSE PROTECTOR LABIAL 4.8
20,7792175001007,4,11188.0,No Promo,BUCHEX FORTE fco.x 200 ml
20,7792175008280,4,7121.0,No Promo,DENTILAC pomo x 40 g
20,7792175009324,4,14821.0,No Promo,PLAC OUT spray x 60 ml
20,7792175009775,4,18703.0,20%,PERPIEL ABSORCION INMEDIATA emuls.c/fraganci x 400g
20,7792175010276,4,22917.0,25%,PERPIEL FACIAL ANTIAGE emuls.x 80 ml
20,7792183001518,4,6233.0,No Promo,SQUAM BLANQUEADOR env.x 60 g
20,7792640002614,4,5100.0,No Promo,CAPILATIS REDUCT.CENTELLA env.x240ml
20,7792640003475,4,12900.0,No Promo,CAPILATIS ACONDICIONADOR HIPOALERGENICO DERM CALM
20,7792640004328,4,10300.0,40%,CAPILATIS  ACONDICIONADOR PLEX 350ML
20,7792640007107,4,5900.0,No Promo,CAPILATIS LINEA PROTECCION ANTI-AGE SHAMPOO 20ML
20,7792640007114,4,5900.0,No Promo,CAPILATIS LINEA PROTECCION ANTI-AGE ACONDICI NADOR 420ML
20,7792640007213,4,5900.0,No Promo,CAPILATIS LINEA PROTECCION DERMO PROTECTOR A x420ml
20,7792640008029,4,8100.0,No Promo,CAPILATIS SHAMPOO PH EXTRA ACIDO PROTEGE EL OLOR X350ML
20,7793100195129,4,5744.0,2x1,COLGATE SENSITIVE PRO ALIVIO INMEDIATO ENCIA CREMA DENTAL 110GR
20,7793487034967,4,8900.0,No Promo,SAINT JULIEN SHAMPOO KIDS SH x500ml 3496
20,7793620003133,4,6909.0,35%,KOTEX NOCTURNA EXTRA PROTECCION CON ALAS TOA LITAS FEMENINAS 16 UNIDA
20,7793742005428,4,17564.0,No Promo,AVENO INFANTIL shamp.x 250 ml
20,7793742007910,4,7815.0,No Promo,DERMAGLOS C M Y U CR 50 GR cr.x 50
20,7793742007927,4,12462.0,No Promo,DERMAGLOS C M Y U CR 120 GR cr.x 120 g
20,7793742024610,4,35290.0,No Promo,PROMOCIONAL DERMAGLËS SOLAR F40 EM 380 ML FP 40 emuls.fr. x 380 ml
20,7793742208508,4,18207.0,No Promo,DERMAGLOS F ULTRA HIDRA CONT cr. gel x 15 g
20,7793970136611,4,9339.0,No Promo,BABELITO BIBERON 0-3m x125ml 13661
20,7793970137618,4,7924.0,No Promo,BABELITO BIBERON x250ml 13761(OFF)
20,7793970137632,4,7924.0,No Promo,BABELITO BIBERON x250ml 13763
20,7793970251208,4,4482.0,No Promo,BABELITO CUBIERTOS ANATOMICOS ART.25120
20,7793970251345,4,4119.0,No Promo,BABELITO VASO BEBETODO x1u ART.25134
20,7793970324032,4,7707.0,No Promo,BABELITO CHUPETE LUMINOSO SILIC.REDONDO T3 1 m+ x1u ART.32403
20,7793970326036,4,5406.000000000001,No Promo,BABELITO CHUPETE ANATOMICO SILIC. T3 x1u 326 3
20,7794626007385,4,20048.0,No Promo,PLENITUD FEMME TOALLITAS NOCTURNAS SIN ALAS UNIDADES
20,7794626011566,4,6909.0,35%,KOTEX NOCTURNA EXTRA PROTECCION CON ALAS TOA LITAS FEMENINAS 16 UNIDA
20,7794640171444,4,8194.0,No Promo,COREGA TABS BLANQUEADOR tab.limp.x 30
20,7794640171703,4,7873.0,No Promo,ULTRA COREGA CREMA pomo x 40 g
20,7794640171741,4,7873.0,No Promo,ULTRA COREGA CREMA SIN SABOR pomo x 40 g
20,7794640173042,4,8194.0,No Promo,COREGA TABS BLANQUEADOR tab.limp.x 30
20,7794728013727,4,6148.0,No Promo,DEPIMIEL CR DEPILATORIA PARA CUERPO ULTRA RA IDA SENSITIVE X120GR
20,7795513239933,4,8490.0,40%,LAIMA JABËN EN PAN X 85 GR HIPOALERG+NICO NE TRO
20,7795513240014,4,5400.0,25%,DARVITA LAIMA ESMALTE KUNZITA P09
20,7795513240113,4,5400.0,No Promo,Laima Base Porcelana
20,7795513240175,4,5400.0,25%,LAIMA AMARGO UĐAS T08
20,7795513240458,4,5400.0,25%,DARVITA LAIMA ESMALTE DE UĐA 25 ESCARLATA
20,7795513240533,4,5400.0,25%,DARVITA LAIMA ESMALTE MALQUITA 11ML
20,7795513240632,4,5400.0,25%,LAIMA CORAL P04
20,7795513240649,4,5400.0,25%,LAIMA AQUA P05
20,7795513240656,4,5400.0,25%,DARVITA LAIMA ESMALTE  MERMAID 11ML
20,7795513240694,4,5400.0,25%,DARVITA LAIMA ESMALTE  PECAN 11ML
20,7795513240823,4,5400.0,25%,LAIMA ESMALTE RASIN 44
20,7796045602431,4,7380.0,No Promo,SISCOM TORTULAN ANTIARRUGAS CON VITAMINA C Y RETINOL CREMA 110ML
20,7796235003000,4,4001.0,No Promo,PELLIZA ESPONJA VEGETAL REDONDA x1u ART.1450
20,7796285289003,4,4590.0,20%,ADERMICINA CUIDADO FACIAL humec.crx90g pcio mbat.
20,7796285289324,4,6945.0,25%,EVAGINA jabžn lÝq. x 200 ml
20,7798026347805,4,550.0,No Promo,ABIEN APOSITOS DE TELA 10 UNIDADES
20,7798028881697,4,90142.0,20%,SILFAB NEBULIZADOR A PISTON N27-A (NEOVENTO)
20,7798028883783,4,29937.0,No Promo,SILFAB OXIMETRO YK-80C
20,7798029222109,4,9760.0,No Promo,PELLIZA ARQUEADOR PESTAĐAS EASY GRIP
20,7798029260507,4,18398.0,No Promo,PELLIZA ALICATE CORTACUTICULA x1u ART.2100
20,7798029260934,4,4388.0,No Promo,PELLIZA GORRA TERMICA p/BAĄO DE CREMA x1u AR .1494
20,7798029272340,4,8509.0,No Promo,PELLIZA BROCHA MAQ.CONTORNO blist.x1u 7234
20,7798051853364,4,31591.0,No Promo,PANADERM AE emuls.x 250 ml
20,7798051854453,4,45675.0,30%,PROAVENAL OMEGATOPIC leche emoliente x 750 m
20,7798095717219,4,3889.0,No Promo,MR BROCHE H2212
20,7798095719954,4,2529.0,No Promo,MR BROCHE x1u ART.BG03
20,7798111211691,4,14800.0,No Promo,ACF BY DADATINA BODY SOLUTION TRAT EXFOLIANT CORPORAL X 200GR
20,7798122341578,4,20440.0,No Promo,VIASEK REPAIR gel x 30 ml
20,7798122341691,4,11220.0,No Promo,VIASEK MEN CUIDADOS INTIMOS fco. x 75 ml (66 g)
20,7798127370924,4,38490.0,No Promo,CHER DIECIOCHO EDP 100ML
20,7798140251514,4,11019.0,35%,GOICOECHEA anti-cel.cell.NF mphx400
20,7798140253198,4,18120.0,No Promo,CICATRICURE Cr.NF c/biopeptide x 60g
20,7798140253266,4,6525.0,No Promo,GOICOECHEA promo reafirm.30% x400ml
20,7798140255536,4,2868.0000000000005,No Promo,NEXT AB jab.lÝq. bal.care x250ml
20,7798140255604,4,6461.0,No Promo,ASEPXIA GEN agua micelar x 200ml
20,7798140256649,4,9292.000000000002,60%,TIO NACHO shamp.aclaranteV2 x415ml
20,7798140257028,4,2714.0,2x1,M FORCE ULTRA SENSIBLE PRESERVATIVO 3 UNIDAD S
20,7798140257530,4,3490.0,35%,TEATRICAL Aclaradora v2 cr.x 100 g
20,7798140257547,4,3490.0,35%,TEATRICAL Antiarrugas v2 cr.x100 g
20,7798140257813,4,10548.0,35%,TEATRICAL serum antiarruga x 30 ml
20,7798140257868,4,9292.000000000002,30%,TIO NACHO EFECTO ANTI CANAS ACONDICIONADOR 4 5ML
20,7798140259299,4,11249.0,No Promo,GOICOECHEA FLEBO env. x 200 ml
20,7798140259992,4,7875.0,No Promo,DIABET TX PLUS env.x 200 ml
20,7798142356392,4,7539.0,No Promo,GUM CLASSIC 411 SUAVE CEPILLO DENTAL 2 UNIDA ES
20,7798168990112,4,29585.0,No Promo,DERMABIDIOL CB cr.x 50 g
20,7798173570132,4,28400.0,No Promo,ECOHAIR CEJAS gel x 5 ml
20,7798175714749,4,4100.0,No Promo,BOOS MIDNIGHT WOM DESODORANTE 127ML
20,7798175718426,4,4100.0,No Promo,BOOS INTENSE WOM DESODORANTE 127ML
20,7798175719713,4,39000.0,No Promo,BOOS BLACK EXTREME WOM EDP 100ML
20,7798178623581,4,38700.0,No Promo,EXIMIA HYALU FILLER 3D COMPLEX OJOS airless 15g
20,7798178623604,4,53700.0,No Promo,EXIMIA HYALU VOLUME COMPLEX 3D NOCHE airless x50g
20,7798178627015,4,37300.0,No Promo,EXIMIA HYALU-R CONCENTRE got. x 15 ml
20,7798182770257,4,23700.0,No Promo,CEPAGE CICANOL QD pomo x 15 g
20,7798182771209,4,34800.0,No Promo,CEPAGE RENOVATEURS GLICOLICO 5X50 G
20,7798187600733,4,11900.0,25%,PURA SOAP SH. SOLIDO TODO TIPO CABELLOX60GR
20,7798187600740,4,11900.0,25%,PURA SOAP SH. SOLIDO C.SECOX60GR
20,7798187600757,4,11900.0,25%,PURA SOAP SH.SOLIDO C.GRASOX60GR
20,7798187600801,4,11590.0,No Promo,PURA SOAP FLORAL SIN ALUMINIO DESOX55GR
20,7798187600818,4,11590.0,No Promo,PURA SOAP CITRICO SIN ALUMINIO DESOX55GR
20,7798187601006,4,9890.0,No Promo,PURA SOAP BODY MIST THE PURE CITRICO 75ML
20,7798187601051,4,29500.0,25%,PURA SOAP ULTRA PROTECTOR FACIAL FLUIDO SPF6 COLOR LAGHT CREMA 30ML
20,7798187601068,4,29500.0,25%,PURA SOAP ULTRA FACIAL PROTECTOR SPF60
20,7798187601112,4,16790.0,No Promo,PURA SOAP THE PURE KIT
20,7798187601129,4,16790.0,No Promo,PURA SOAP AUDACE  KIT
20,7798187601181,4,17300.0,25%,PURA SOAP CREMA CORPORAL VEGETAL DE COCO 300 L
20,7798187601204,4,17300.0,25%,PURA SOAP CREMA CORPORAL VEGETAL DE GALDERNI 300ML
20,7798332022342,4,15100.0,No Promo,NATURAL SPIRIT CRAZY LOVE BODY SPLASH 250ML
20,7798332023509,4,15100.0,No Promo,NATURAL SPIRIT CRAZY LOVE BODY SPLASH 250ML
20,7798332023905,4,37009.0,No Promo,BOOS INTENSE ROSE WOM EDP 90ML + DEO 127ML R GALO
20,7798336946835,4,29990.0,No Promo,CHER ONYX COFRE BODY SPLASH 200ML+BODY LOTIO 200ML
20,7798336946842,4,29990.0,No Promo,CHER ZARCI BODY SPLASH 200ML+BODY LOTION 200 L COFRE
20,7798336947818,4,35990.0,No Promo,TUCCI ANIMA EDP 100ML
20,7798336947948,4,45990.0,No Promo,BENSIMON BRAVE EDP 100ML
20,7798336948501,4,29990.0,No Promo,CHER ONYX COFRE BODY SPLASH 200ML+BODY LOTIO 200ML
20,7798336948518,4,29990.0,No Promo,CHER ZARCI BODY SPLASH 200ML+BODY LOTION 200 L COFRE
20,7798338948518,4,29990.0,No Promo,CHER ZARCI BODY SPLASH 200ML+BODY LOTION 200 L COFRE
20,7798339190099,4,1669.0,No Promo,ESPADOL DETTOL EXFOLIANTE JABON 80GR X1UNI
20,7798339190129,4,4259.0,No Promo,ESPADOL JABON SKINCARE  80GR X3 UNIDADES
20,7798339190433,4,10642.000000000002,No Promo,VEET FOR MEN PIEL NORMAL CREMA DEPILATORIA 2 0ML
20,7798422000021,4,45990.0,No Promo,CHER DIECIOCHO ELIXIR  PARFUM 100ML
20,7798422002803,4,29990.0,No Promo,CHER ONYX COFRE BODY SPLASH 200ML+BODY LOTIO 200ML
20,7798422002810,4,29990.0,No Promo,CHER ZARCI BODY SPLASH 200ML+BODY LOTION 200 L COFRE
20,7799075001120,4,68100.0,No Promo,AVENE AJOXITIVE C. DIAX30ML
20,7799075002134,4,27450.0,No Promo,AVENE CICALFATE + GEL LAVANTE 200ML
20,7891010009250,4,7606.0,No Promo,NEUTROGENA DEEP CLEAN gel x150ml
20,7891010245573,4,5886.000000000001,No Promo,OB SIEMPRE LIBRE ORIGINAL CURVO MEDIO TAMPON 16 UNIDADES
20,7891010247324,4,4505.0,No Promo,JOHNSON BABY LIMPIEZA Y SUAVIDAD TOALLITAS H MEDAS 44 UNIDADES
20,7891010254476,4,5912.0,No Promo,LISTERINE FRESHBURST FRESCURA SUAVE  ENJUAGU BUCAL X 250ML
20,7891010254490,4,6836.0,No Promo,LISTERINE ANTI SARRO ENJUAGUE BUCAL  250ML
20,7891010254773,4,3425.0,No Promo,OB SIEMPRE LIBRE ORIGINAL CURVO MEDIO TAMPON 8 UNIDADES
20,7891010254797,4,5886.000000000001,No Promo,OB SIEMPRE LIBRE ORIGINAL CURVO MEDIO TAMPON 16 UNIDADES
20,7891010255268,4,6836.0,No Promo,LISTERINE ANTI SARRO ENJUAGUE BUCAL  250ML
20,7891010255329,4,5912.0,No Promo,LISTERINE FRESHBURST FRESCURA SUAVE  ENJUAGU BUCAL X 250ML
20,7891010619404,4,6836.0,No Promo,LISTERINE ANTI SARRO ENJUAGUE BUCAL  250ML
20,7891010972226,4,7606.0,No Promo,NEUTROGENA DEEP CLEAN FACIAL JABON X 150G
20,7891024019610,4,7584.0,No Promo,COLGATE PERIOGARD EXTRA SOFT CEPILLO DENTAL UNIDAD
20,7891024033289,4,10175.0,No Promo,COLGATE TOTAL 12 ENCIAS SANAS CREMA DENTAL 1 0GR
20,7891024034590,4,4595.0,No Promo,COLGATE PRO CUIDADO SUAVE CEPILLO DENTAL 2 U IDADES
20,7891024073001,4,2474.0,No Promo,COLGATE BATMAN Y MUJER MARAVILLA +6A PACKS 2 1 CEPILLO DENTAL 2U
20,7891024078174,4,6317.0,No Promo,COLGATE BAMBOO SUAVE CEPILLO DENTAL 2 UNIDAD S
20,7891024135020,4,5722.0,No Promo,COLGATE TOTAL 12 BLANQUEADORA CREMA DENTAL 9 GR
20,7891150025929,4,4806.000000000001,No Promo,DOVE BABY ENRIQUECIDO SHAMPOO 200ML
20,7891350039528,4,3930.0,3x2,RISQUE BIO GIRASOL 9ml
20,7891350040043,4,2900.0,3x2,RISQUE ESMALTE SEM FILTRO 8ML
20,7896007551002,4,20048.0,No Promo,PLENITUD FEMME TOALLITAS NOCTURNAS SIN ALAS UNIDADES
20,7896009419324,4,5082.0,No Promo,SENSODYNE ORIGINAL cr.dental x 90 g
20,7896015519223,4,4311.0,No Promo,SENSODYNE EXTRA FRESH BLANQUEADOR cr.dental 50 g
20,7896015527457,4,7128.0,No Promo,PARODONTAX FLUOR cr.dental x 90 g
20,7897930762077,4,44067.0,No Promo,CETAPHIL HIDRATANTE FACIAL DIARIO FPS 15 SPF emuls.x 118 ml
20,7898587774925,4,4238.0,40%,ELVIVE OLEO EXTRAORDINARIO NUTRI UNIVERSAL A ONDICIONADOR 200ML
20,7898587775120,4,4238.0,40%,ELVIVE OLEO EXTRAORDINARIO COCO SHAMPOO 200M
20,7899026404892,4,4432.0,No Promo,COLORAMA CREMOSO ESM.x8ml (BLANCO FRANCES)
20,7899026424210,4,4432.0,No Promo,COLORAMA GIO ESM.x8ml (GLAMOUR)
20,7899026424234,4,3301.0,No Promo,COLORAMA CREMOSO ESM.x8ml (NOITE QUENTE)
20,7899706181877,4,18000.0,30%,LOREAL UV DEFENDER Hidrat. Intensa FPS+50 x 0ml
20,8429420175310,4,63299.0,No Promo,ISDIN GLICOISDIN 15 gel x50ml
20,8429420203082,4,107714.0,No Promo,ISDIN CEUTICS VITAL EYES 15ML
20,8429420216068,4,113692.0,No Promo,ISDIN ISDINCEUTICS FLAVO C FORTE 3U
20,8429420227590,4,62839.0,No Promo,ISDIN ACNIBEN TS GEL LIMPIADOR MATIFICANTE 400ML
20,8470001527349,4,50840.0,No Promo,ISDIN UREADIN PODOS REPARADOR TALON&PIES gel oil x75ml
20,8470001654557,4,62446.0,No Promo,ISDIN FOTOPROTECTOR 50+ BRONCE compacto x10g
20,8470002006454,4,61158.0,No Promo,ISDIN NUTRATOPIC PRO AMP EMOLIENTE cr.x200ml
20,8470002426382,4,63299.0,No Promo,ISDIN GLICOISDIN 15 gel x50ml
20,8470003245920,4,53100.0,No Promo,ISDIN ACNIBEN EQUILIB gel x40ml
20,8710103914082,4,71999.0,15%,PHILIPS CORTACABELLOS HC5632/15
20,8809192705470,4,25299.0,50%,DARVITA COONY PURE ALOE SOOTHING GEL HYALURO IC  300ML
20,8809373570026,4,5499.0,No Promo,DARVITA COONY MASCARA FACIAL ALOE
20,8906038786102,4,12999.0,No Promo,SRI SRI GEL DE LIMPIEZA FACIAL PARA PIELES C N ACNE 100GR
20,8906038786416,4,7999.0,No Promo,SRI SRI SUDANTA AYURVEDICA SIN FLUOR MENTA G L 100GR
20,6923700941739,39,4440.0,No Promo,GARNIER HIDRA-BOMB MASC.TELA p/OJOS blist.x1 ar(NJA+AC.HIAL)
20,7500435229531,39,4717.0,35%,ALWAYS XTRA DOBLE PROTECCION SUAVE TOALLITA EMENINA 16 UNIDADES
20,7506306249998,39,3846.0,40%,AXE GREEN GERANIUM DESODORANTE 150ML
20,7791293006406,39,3846.0,40%,AXE GREEN GERANIUM DESODORANTE 150ML
20,7791293037615,39,837.0,No Promo,LUX JAZMIN CREMOSO JABON 125GR 1UNIDAD
20,7791293044248,39,837.0,No Promo,LUX JAZMIN CREMOSO JABON 125GR 1UNIDAD
20,7791293050768,39,3611.0,No Promo,LUX BROMELIA GLICERINA JABON LIQUIDO RESPUES O 220ML
20,7791293050843,39,837.0,No Promo,LUX JAZMIN CREMOSO JABON 125GR 1UNIDAD
20,4005900436948,38,6665.0,No Promo,NIVEA LABELLO FPS30 PROTECTOR LABIAL 4.8
20,4006000005515,38,6665.0,No Promo,NIVEA LABELLO FPS30 PROTECTOR LABIAL 4.8
20,7790010002240,38,3128.0,40%,CAREFREE TODOS LOS DIAS PROTECCION 20 UNIDAD S
20,7790010002820,38,3128.0,40%,CAREFREE TODOS LOS DIAS PROTECCION 20 UNIDAD S
20,7790010616737,38,3128.0,40%,CAREFREE TODOS LOS DIAS PROTECCION 20 UNIDAD S
20,7791293034584,38,3778.0,35%,DOVE GO FRESH PERA Y ALOE VERA DESODORANTE F M 150ML
20,7791293040059,38,3778.0,35%,DOVE GO FRESH PERA Y ALOE VERA DESODORANTE F M 150ML
20,7791293046266,38,3778.0,35%,DOVE GO FRESH PERA Y ALOE VERA DESODORANTE F M 150ML
20,7791293048505,38,3778.0,35%,DOVE GO FRESH PERA Y ALOE VERA DESODORANTE F M 150ML
20,7793100130243,38,6979.0,No Promo,COLGATE PERIOGARD CREMA DENTAL 90GR
20,4005900170996,37,825.0,No Promo,CURITAS APOSITOS TELA ELASTICA 8 UNIDADES
20,7500435229487,37,3986.0,35%,ALWAYS XTRA NOCHES TRANQUILAS SECA TOALLITA EMENINA 8 UNIDADES
20,7509552930337,37,4238.0,40%,ELVIVE GLYCOLIC GLOSS ACONDICIONADOR  200ML
20,7702003010743,37,825.0,No Promo,CURITAS APOSITOS TELA ELASTICA 8 UNIDADES
20,7791293037080,37,1012.0,No Promo,REXONA ANTIBACTERIAL ORIGINAL JABON X1 UNIDA 90G
20,7791293040585,37,1012.0,No Promo,REXONA ANTIBACTERIAL ORIGINAL JABON X1 UNIDA 90G
20,7791293046860,37,1012.0,No Promo,REXONA ANTIBACTERIAL ORIGINAL JABON X1 UNIDA 90G
20,75486088620,36,25166.0,No Promo,HAWAIIAN FPS50 SHEER TOUCH loc.x120ml
20,7790010002271,36,2844.0,No Promo,CAREFREE PROTECCION DIARIOS 20 UNIDADES
20,7790010002875,36,2844.0,No Promo,CAREFREE PROTECCION DIARIOS 20 UNIDADES
20,7790010616782,36,2844.0,No Promo,CAREFREE PROTECCION DIARIOS 20 UNIDADES
20,7791293028781,36,2686.0,No Promo,AXE BLACK REMIXED BZRP DESODORANTE 150ML
20,7791293041117,36,2686.0,No Promo,AXE BLACK REMIXED BZRP DESODORANTE 150ML
20,7791293043821,36,2686.0,No Promo,AXE BLACK REMIXED BZRP DESODORANTE 150ML
20,7798008963122,36,1619.0,No Promo,OTOWIL ACEITE DE ARGAN S.X9CM
20,7891150089952,36,5051.000000000001,No Promo,REXONA CLINICAL WOM REFRESH DESODORANTE 96H 50ML
20,7509552790443,35,6547.0,40%,ELVIVE OLEO EXTRAORDINARIO COCO ACONDICIONAD R 400ML
20,7509552791280,35,6547.0,40%,ELVIVE OLEO EXTRAORDINARIO NUTRICION UNIVERS L ACONDICIONADOR 400ML
20,7509552937343,35,4238.0,40%,ELVIVE GLYCOLIC GLOSS SHAMPOO 200ML
20,7790010002318,35,3591.0,60%,CAREFREE LONGS DIARIOS PROTEC X 20 UNIDADES
20,7790010002790,35,3591.0,60%,CAREFREE LONGS DIARIOS PROTEC X 20 UNIDADES
20,7790010616805,35,3591.0,60%,CAREFREE LONGS DIARIOS PROTEC X 20 UNIDADES
20,7791293022260,35,2788.0000000000005,No Promo,DOVE ORIGINAL BLANCO JABON RESPUESTO 220ML
20,7791293046136,35,2788.0000000000005,No Promo,DOVE ORIGINAL BLANCO JABON RESPUESTO 220ML
20,7898587774949,35,6547.0,40%,ELVIVE OLEO EXTRAORDINARIO NUTRICION UNIVERS L ACONDICIONADOR 400ML
20,7898587775045,35,6547.0,40%,ELVIVE OLEO EXTRAORDINARIO COCO ACONDICIONAD R 400ML
20,30162662,34,54600.0,No Promo,LA ROCHE POSAY ANTHELIOS UV MUNE  SPF50+ ULT A FLUIDO SIN COLOR CREMA
20,75486021689,34,29815.0,No Promo,HAWAIIAN FPS30 SHEER TOUCH ULTRA RADIANCE LO ION 240ML
20,75486088637,34,31844.0,No Promo,HAWAIIAN TROPIC SHEER TOUCH SPF50 PROTECTOR OLAR LOCION 240ML
20,3337875583626,34,93210.0,No Promo,LRP HYALU B5 SERUM fco.x30ml
20,3337875764032,34,54600.0,No Promo,LA ROCHE POSAY ANTHELIOS UV MUNE  SPF50+ ULT A FLUIDO SIN COLOR CREMA
20,3337875797597,34,54600.0,No Promo,LA ROCHE POSAY ANTHELIOS UV MUNE  SPF50+ ULT A FLUIDO SIN COLOR CREMA
20,7506306241176,34,3778.0,35%,DOVE INVISIBLE DRY DESODORANTE FEM 169ML
20,7790520996596,34,14483.0,No Promo,OFF DEFENSE BEBE +3 MESES 6HS REPELENTE GEL 00ML
20,7790520997449,34,14483.0,No Promo,OFF DEFENSE BEBE +3 MESES 6HS REPELENTE GEL 00ML
20,7791293041179,34,3778.0,35%,DOVE INVISIBLE DRY DESODORANTE FEM 169ML
20,7791293046280,34,3778.0,35%,DOVE INVISIBLE DRY DESODORANTE FEM 169ML
20,7791293048529,34,3778.0,35%,DOVE INVISIBLE DRY DESODORANTE FEM 169ML
20,7899706158213,34,93210.0,No Promo,LRP HYALU B5 SERUM fco.x30ml
20,79400110695,33,9041.0,No Promo,REXONA CLINICAL WOM ANTI TRANSPIRANTE CLEAN RESH BARRA 48GR
20,3337875698696,33,71810.0,No Promo,LA ROCHE POSAY ANTHELIOS PEDIATRICO FPS50 SP AY 200ML
20,3337875886055,33,71810.0,No Promo,LA ROCHE POSAY ANTHELIOS PEDIATRICO FPS50 SP AY 200ML
20,7509546686622,33,6335.0,2x1,COLGATE TOTAL 12 CARBON ACTIVADO ENJUAGUE BU AL 250ML
20,7791293049564,33,3066.0,35%,REXONA WOM BAMBOO ALOE DESODORANTE 150ML
20,7798382383813,33,124.0,No Promo,OTOWIL ACONDICIONADOR CON MANTECA DE KARITE OBRE 10G
20,3337875419802,32,61200.0,No Promo,VICHY IDEAL SOLEIL SPF50 ANTIDARK SPOTS pomo x50ml
20,4005900515865,32,3873.0,2x1,NIVEA MEN DEEP ORIGINAL ANTITRANSPIRANTE DES DORANTE 150ML
20,4005900901378,32,3873.0,2x1,NIVEA MEN DEEP ORIGINAL ANTITRANSPIRANTE DES DORANTE 150ML
20,4005900985675,32,3873.0,2x1,NIVEA MEN DEEP ORIGINAL ANTITRANSPIRANTE DES DORANTE 150ML
20,7898422746827,32,1539.0,3x2,DOVE EXFOLIACION DIARIA JABON 90GR 1 UNIDAD
20,8429420154186,32,52981.0,No Promo,ISDIN FOTOPROTECTOR FUSION WATER 50+ COLOR f uido x50ml
20,7509552876482,31,6547.0,40%,ELVIVE HIALURONICO PURE HIDRA EQUILIBRANTE A ONDICIONADOR 400ML
20,7891150035874,31,3197.0,No Promo,DOVE BABY ENRIQUECIDO JABON LIQUIDO RESPUEST 200ML
20,3337875765800,30,54600.0,No Promo,LA ROCHE POSAY ANTHELIOS UV MUNE  SPF50+ ULT A FLUIDO CON COLOR CREMA
20,3337875797641,30,54600.0,No Promo,LA ROCHE POSAY ANTHELIOS UV MUNE  SPF50+ ULT A FLUIDO CON COLOR CREMA
20,7506306214972,30,5051.000000000001,No Promo,REXONA CLINICAL MEN CLEAN DESODORANTE  96HS 10ML
20,7790299003525,30,15932.0,No Promo,ZONO PROTECTOR SOLAR FPS30 CREMA 120ML
20,7791293037646,30,837.0,No Promo,LUX FLOR DE VAINILLA JABON 125GR 1UNIDAD
20,7791293044231,30,837.0,No Promo,LUX FLOR DE VAINILLA JABON 125GR 1UNIDAD
20,7791293049618,30,5893.0,No Promo,DOVE WOM 96HS PROTECCION DESODORANTE 150ML
20,7791293050782,30,837.0,No Promo,LUX FLOR DE VAINILLA JABON 125GR 1UNIDAD
20,7798339190259,30,3507.0,No Promo,ESPADOL JABON LIQUIDO RESPUESTO ORIGINAL  X 20ML
20,7891150035881,30,3197.0,No Promo,DOVE BABY SENSIBLE JABON LIQUIDO RESPUESTO 2 0ML
20,7891150068735,30,5051.000000000001,No Promo,REXONA CLINICAL MEN  SPORT DESODORANTE 96HS 50ML
20,30143678,3,22675.0,No Promo,LOREAL BROWARTIS POMADE PARADISE env.x1u 106(EBONY)
20,30147089,3,18738.0,No Promo,LOREAL PARIS COLOR RICHE INTENSE VOLUME MATT WORTH IT LABIAL 601
20,30152182,3,18738.0,No Promo,LOREAL PARIS COLOR RICHE INTENSE VOLUME MATT LE NUDE RESILENT LABIAL
20,30152199,3,18738.0,No Promo,LOREAL PARIS COLOR RICHE INTENSE VOLUME MATT WORTH IT INTENSE LABIAL
20,30162174,3,21568.0,30%,LOREAL AIR MEGA VOLUM MASC WTP NU 01 BLACK
20,30173583,3,28957.0,No Promo,LOREAL INFALLIBLE MORE THAN CONCELEAR env.323(FAWN)
20,30174108,3,18523.0,No Promo,MAYBELLINE MATTE INK CRAYON NU 45 HUSTLE
20,30188617,3,22894.000000000004,No Promo,LOREAL PARIS INFAILLIBLE MATTE RESISTENCE WO TH IT LABIAL LIQUIDO 601
20,30188655,3,22894.000000000004,No Promo,LOREAL PARIS INFAILLIBLE MATTE RESISTENCE WO TH IT MEDIUM LABIAL LIQU
20,30188662,3,22894.000000000004,No Promo,LOREAL PARIS INFAILLIBLE MATTE RESISTANCE CR SH ALERT LABIAL LIQUIDO
20,20800307642,3,6816.0,No Promo,OLD SPICE FRESH DESODORANTE BARRA 60GR
20,41554070972,3,21339.000000000004,No Promo,MAYBELLINE SUPERSTAY VINYL INK WICKED LABIAL LIQUIDO 4.2ML
20,41554079302,3,21339.000000000004,No Promo,MAYBELLINE VINYL INK 120 PUNCHY UN INT LABIA
20,41554079319,3,21339.000000000004,No Promo,MAYBELLINE VINYL INK 115 PEPPY UN INT LABIAL
20,41554080407,3,21339.000000000004,No Promo,MAYBELLINE VINYL INK 105 GOLDEN UN INT LABIA
20,41554259254,3,22533.0,35%,MAYBELLINE IAR (INSTANT AGE REWIND) ERASER EYE TONO LIGHT x6ml
20,41554267204,3,22533.0,35%,MY IAR E.DARK CIRCLES BRIGHTENER
20,41554545876,3,19970.0,No Promo,LOREAL TATTOO BROW GEL CARTON DEEP BROWN
20,41554550122,3,17588.0,35%,MAYBELLINE FIT ME CONCEALER DEEP 35
20,41554583885,3,19504.000000000004,No Promo,MAYBELLINE LIFTER GLOSS SILK LABIAL LIQUIDO 04
20,47400241459,3,9001.0,No Promo,GILLETTE FOAMY MENTOL ESPUMA 312GR
20,70942125925,3,5222.0,No Promo,GUM TECHNIQUE SENSITIVE PINK CEPILLO DENTAL UNIDAD
20,70942302357,3,3276.0,No Promo,GUM TAPAS PROTECTORAS PARA CEPILLOS DENTALES 4 UNIDADES
20,70942507233,3,3898.0,No Promo,GUM ORTHODONTIC CERA DE ORTODONCIA VIT E 5 U IDADES
20,70942914147,3,5556.000000000001,No Promo,GUM PROXABRUSH 2 CEPILLO INTERDENTAL 4 UNIDA ES
20,71249410585,3,23636.0,No Promo,LOREAL BRILLANT EYES AMETHIST QUARTZ 425
20,71249410653,3,23636.0,No Promo,LOREAL BRILLANT EYES CROWN GOLD 445
20,71249680971,3,30174.0,No Promo,LOREAL PARIS PANORAMA MASCARA DE PESTANA BLA K
20,73796612320,3,110155.0,No Promo,OMRON TENSIOMETRO MUĐECA HEM 6123
20,309970050559,3,17290.0,No Promo,REVLON ColorStay delineador para cejas c/ ge 303 medium brown
