codigo,ean,stock,precio,promo,descripcion
20,75027513,17,4960.0,30%,DOVE ORIGINAL DESODORANTE BARRA 50GR
20,75080136,17,4960.0,30%,DOVE ORIGINAL DESODORANTE BARRA 50GR
20,78009227,17,4960.0,30%,DOVE ORIGINAL DESODORANTE BARRA 50GR
20,3086123549999,17,15000.0,No Promo,BIC FLEX 3 HYBRID MAQUINA DE AFEITAR CON 5 R SPUESTOS - 968777
20,3337871323622,17,49800.0,No Promo,VICHY IDEAL SOLEIL PROTECTOR SOLAR SPF50+ TO UE SECO CREMA 50ML
20,4005900499257,17,13641.0,40%,NIVEA MICELAR  LOCION EXPERT BIFAS O2 X  400 L
20,4006000016702,17,18268.0,No Promo,NIVEA SUN FPS 30 PROTECT & HYDRATE EMULCION 200ML
20,6923700990492,17,5800.0,No Promo,GARNIER MASCARA DE LABIOS  SKINACNTIVE CHERR
20,7500435225366,17,7834.0,25%,GILLETTE MACH 3 CARBONO  CARTUCHO 2 UNIDADES
20,7509546685847,17,1527.0,No Promo,ODOLITO KIDS TUTTI FRUTI CREMA DENTAL 50GR
20,7509546686677,17,8744.0,No Promo,COLGATE LUMINOUS WHITE PLAX  ENJUAGUE BUCAL 00ML
20,7509546693170,17,1527.0,No Promo,ODOLITO KIDS TUTTI FRUTI CREMA DENTAL 50GR
20,7509552794557,17,25650.0,30%,LOREAL REVITALIFT ACIDO HIALURONICO EYE SERU 20ML
20,7509552796131,17,23900.0,30%,LOREAL REVITALIFT ACIDO HIALURONICO ANTI BRI LO GEL 50ML
20,7790299003679,17,5776.000000000001,No Promo,FERRINI ORDENE CLASICA CREMA 200ML
20,7790375269302,17,13622.0,No Promo,BAGOVIT A BRONCEADO PROGRESIVO Emuls.spr.con . x 150 ml
20,7791293004976,17,5772.0,40%,DOVE RECONSTRUCCION COMPLETA ACONDICIONADOR 00ML
20,7791293025834,17,3041.0,No Promo,AXE MUSK 48HS FRAGANCIA + FRESCURA CANELA Y MBAR DESODORANTE 150ML
20,7791293041094,17,3041.0,No Promo,AXE MUSK 48HS FRAGANCIA + FRESCURA CANELA Y MBAR DESODORANTE 150ML
20,7791293042275,17,5772.0,40%,DOVE RECONSTRUCCION COMPLETA ACONDICIONADOR 00ML
20,7791293043807,17,3041.0,No Promo,AXE MUSK 48HS FRAGANCIA + FRESCURA CANELA Y MBAR DESODORANTE 150ML
20,7791293045191,17,5772.0,40%,DOVE RECONSTRUCCION COMPLETA ACONDICIONADOR 00ML
20,7791293047508,17,5772.0,40%,DOVE RECONSTRUCCION COMPLETA ACONDICIONADOR 00ML
20,7891024139165,17,1527.0,No Promo,ODOLITO KIDS TUTTI FRUTI CREMA DENTAL 50GR
20,75026455,16,4067.0,40%,REXONA WOM NUTRITIVE BARRA 50GR
20,75076771,16,4067.0,40%,REXONA WOM NUTRITIVE BARRA 50GR
20,70942004114,16,4188.0,No Promo,GUM CLASSIC 411 CEPILLO DENTAL + FLOSSERS 1 NIDAD
20,3337871310714,16,61295.0,No Promo,VICHY IDEAL SOLEIL AUTOBRONCEANTE LAIT CORPO AL POMO 100ML
20,3337875762298,16,59415.0,No Promo,VICHY IDEAL SOLEIL  PROTECTOR SOLAR FPS50+ U -AGE DAILY SPRAY 40ML
20,3577057054289,16,7250.0,No Promo,ELGYDIUM CLINIC 20/100 SUAVE CEPILLO DENTAL UNIDAD
20,4005808336845,16,8784.0,40%,NIVEA SOFT MILK 5EN1 PIEL SECA CREMA CORPORA 400ML
20,4006000040424,16,8784.0,40%,NIVEA SOFT MILK 5EN1 PIEL SECA CREMA CORPORA 400ML
20,7500435155861,16,8043.0,No Promo,PANTENE PRO-V MIRACLES REVITALIZACION ACONDI IONADOR 400ML
20,7500435235426,16,8043.0,No Promo,PANTENE PRO-V MIRACLES REVITALIZACION ACONDI IONADOR 400ML
20,7501843502926,16,17000.0,No Promo,BIC SOLEIL CLIC SENSITIVE MAQUIINA DE AFEITA CON 5 RESPUESTO - 96977
20,7509546061689,16,5725.0,No Promo,COLGATE SLIM SOFT BLACK SUAVE 2X1 CEPILLO DE TAL 2 UNIDADES
20,7509552849516,16,5853.0,No Promo,GARNIER FRUCTIS HAIR FOOD SANDIA ACONDICIONA OR 300ML
20,7509552874068,16,5853.0,No Promo,GARNIER FRUCTIS HAIR FOOD SANDIA ACONDICIONA OR 300ML
20,7730188270492,16,6390.0,20%,DR SELBY ESPUMA DE AFEITAR 149GR
20,7790010002677,16,7218.0,No Promo,SIEMPRE LIBRE ADAPT PLUS NOCHE Y DIA SUAVE C N ALAS TOALLA FEMENINA 1
20,7790010570831,16,7218.0,No Promo,SIEMPRE LIBRE ADAPT PLUS NOCHE Y DIA SUAVE C N ALAS TOALLA FEMENINA 1
20,7790375269449,16,28402.0,No Promo,BAGOVIT SOLAR FP50 spray transp.x200ml
20,7791001000399,16,3082.0,No Promo,BIF TINE+MAS ADIT.ACOND.
20,7791293023892,16,5772.0,40%,DOVE HIDRATACION INTENSA ACONDICIONADOR 400M
20,7791293032467,16,3066.0,35%,REXONA WOM COTTON DESODORANTE 150ML
20,7791293041728,16,3066.0,35%,REXONA WOM COTTON DESODORANTE 150ML
20,7791293045146,16,3066.0,35%,REXONA WOM COTTON DESODORANTE 150ML
20,7791293047546,16,5772.0,40%,DOVE HIDRATACION INTENSA ACONDICIONADOR 400M
20,7791293049533,16,3066.0,35%,REXONA WOM COTTON DESODORANTE 150ML
20,7791293050355,16,5772.0,40%,DOVE HIDRATACION INTENSA ACONDICIONADOR 400M
20,7793742003790,16,24868.0,No Promo,DERMAGLOS LINEA SOLAR FPS50 niąo emuls.x180 l
20,7794626013980,16,21659.000000000004,No Promo,HUGGIES LA SIRENITA TOALLAS HUMEDA 4EN1 80 U IDADES (EDICION LIMITADA
20,7798067996000,16,7250.0,No Promo,ELGYDIUM CLINIC 20/100 SUAVE CEPILLO DENTAL UNIDAD
20,7798140256724,16,9292.000000000002,60%,TIO NACHO shamp.engrosadorV2 x 415
20,7798187601242,16,7300.0,25%,PURA SOAP CHOCOLATE BALSAMO LABIAL 3.5
20,7891010607135,16,7218.0,No Promo,SIEMPRE LIBRE ADAPT PLUS NOCHE Y DIA SUAVE C N ALAS TOALLA FEMENINA 1
20,7891024030813,16,7480.0,2x1,COLGATE PRO ALIVIO ENJUEGUE BUCAL 250ML
20,7891024064290,16,4360.0,No Promo,COLGATE SLIM SOFT ADVANCED SUAVE CEPILLO DEN AL 1 UNIDAD
20,7891150050501,16,5772.0,40%,DOVE HIDRATACION INTENSA ACONDICIONADOR 400M
20,7891150082694,16,5772.0,40%,DOVE HIDRATACION INTENSA ACONDICIONADOR 400M
20,8429420188020,16,83163.0,No Promo,ISDIN FOTOPROTECTOR 50+ PEDIATRICS WET SKIN nv.x200ml(TS)
20,75024956,15,4067.0,30%,REXONA MEN V8 BARRA 50GR
20,75076788,15,4067.0,30%,REXONA MEN V8 BARRA 50GR
20,4005808257584,15,2348.0000000000005,25%,NIVEA DRY COMFORT UNISEX A/T DESO.ROLL-ON x5 ml
20,7500435235365,15,8043.0,No Promo,PANTENE PRO-V MIRACLES LISO INFINITO ACONDIC ONADOR 400ML
20,7506306252844,15,17422.0,30%,DOVE PANTENOL PIEL SENSIBLE Y EXTRA SECA COR ORAL SERUM 400ML
20,7509546686592,15,5884.0,2x1,COLGATE TOTAL12 CLEAN MINT ENJUEGUE BUCAL 25 ML
20,7509552222349,15,3279.0,No Promo,GARNIER FRUCTIS RIZOS PODEROSOS ACONDICIONAD R 200ML
20,7509552805871,15,3279.0,No Promo,GARNIER FRUCTIS RIZOS PODEROSOS SHAMPOO 200M
20,7509552805918,15,3279.0,No Promo,GARNIER FRUCTIS RIZOS PODEROSOS ACONDICIONAD R 200ML
20,7509552844160,15,5853.0,No Promo,GARNIER FRUCTIS HAIR FOOD BANANA ACONDICIONA OR 300ML
20,7509552844658,15,3279.0,No Promo,GARNIER FRUCTIS RIZOS PODEROSOS SHAMPOO 200M
20,7509552844665,15,3279.0,No Promo,GARNIER FRUCTIS RIZOS PODEROSOS ACONDICIONAD R 200ML
20,7509552874174,15,5853.0,No Promo,GARNIER FRUCTIS HAIR FOOD BANANA ACONDICIONA OR 300ML
20,7509552920925,15,3279.0,No Promo,GARNIER FRUCTIS RIZOS PODEROSOS SHAMPOO 200M
20,7509552922349,15,3279.0,No Promo,GARNIER FRUCTIS RIZOS PODEROSOS ACONDICIONAD R 200ML
20,7791293030777,15,4046.0,No Promo,SEDAL CERAMIDAS SH X 340ml
20,7791293043357,15,4046.0,No Promo,SEDAL CERAMIDAS SH X 340ml
20,7791293045733,15,4046.0,No Promo,SEDAL CERAMIDAS SH X 340ml
20,7791293049625,15,6188.0,No Promo,DOVE MEN CARE 96HS PROTECCION  DESODORANTE 1 0ML
20,7793742108518,15,21434.000000000004,No Promo,DERMAGLOS F ULTRA HIDRATACION cr. gel x 50 g
20,7798032936772,15,7699.0,30%,FLUOROGEL JUNIOR Menta x 60 g
20,7798154630015,15,7500.0,No Promo,BIOCLEAN TIRAS REMOVEDORAS NARIZ 5 UNIDADES BC101)
20,7798154630107,15,6500.0,No Promo,BIOCLEAN CREMA PIES POWER REPAIR 75GR
20,7798187601136,15,7300.0,25%,PURA SOAP TUTTI FRUTTI BALSAMO LABIAL 3.5
20,7891010249861,15,27567.0,No Promo,NEUTROGENA BRIGHT BOOST FACIAL GEL CREMA 50G
20,7891024028018,15,5884.0,2x1,COLGATE TOTAL12 CLEAN MINT ENJUEGUE BUCAL 25 ML
20,7891024028834,15,5884.0,2x1,COLGATE TOTAL12 CLEAN MINT ENJUEGUE BUCAL 25 ML
20,8429420078581,15,59465.0,No Promo,ISDIN FOTO ULTRA ACTIVE UNIFY COLOR SPF50 FU ION FLUIDO 50ML
20,8429420160668,15,59465.0,No Promo,ISDIN FOTO ULTRA ACTIVE UNIFY COLOR SPF50 FU ION FLUIDO 50ML
20,7797321016546,147,6249.0,No Promo,BONXEN REPELENTE SPRAY 200ML
20,4580193651389,143,8159.0,No Promo,CITIZEN TERMOMETRO DIGITAL termometro x1u CT301
20,75027537,14,4960.0,30%,DOVE INVISIBLE DRY DESODORANTE BARRA 50GR
20,75080150,14,4960.0,30%,DOVE INVISIBLE DRY DESODORANTE BARRA 50GR
20,3337875607254,14,98045.0,No Promo,VICHY LIFTACTIVE SPECIALIST COLLAGEN DAY cr. 50ml
20,3337875694469,14,109240.0,No Promo,LRP RETINOL B3 SERUM 30ML
20,3337875764353,14,65025.0,No Promo,LA ROCHE POSAY ANTHELIOS PROTECTOR SOLAR FPS 0 AGE CORRECT COLOR SPRA
20,3614228686754,14,22851.0,No Promo,RIMMEL SCAND.ON DEMAND MASC BLACK
20,4005800137679,14,3175.0,No Promo,NIVEA cr.x60gr (lata)
20,4005808555796,14,18268.0,No Promo,NIVEA SUN SPF30 PROTECT&BRONZE emul.x200ml
20,4005900887818,14,22607.0,No Promo,NIVEA CELLULAR LUMINOUS NOCHE CREMA 50ML
20,6923700990508,14,5800.0,No Promo,GARNIER MASCARILLA REPARADORA LABIOS
20,7500435191418,14,4961.000000000001,25%,PANTENE PRO-V MIRACLES COLAGENO SHAMPOO 200M
20,7506306252974,14,10453.0,30%,DOVE PANTENOL PIEL SENSIBLE Y EXTRA SECA COR ORAL SERUM 200ML
20,7509546073453,14,1779.0,No Promo,COLGATE KIDS +5A PACK 2X1 CEPILLO DENTAL 2 U IDADES
20,7702003008504,14,18268.0,No Promo,NIVEA SUN SPF30 PROTECT&BRONZE emul.x200ml
20,7790520025395,14,6433.0,No Promo,OFF FAMILY REPELENTE MOSQUITOS 6HS AEROSOL 1 0CM
20,7790520996329,14,6433.0,No Promo,OFF FAMILY REPELENTE MOSQUITOS 6HS AEROSOL 1 0CM
20,7791293037066,14,2591.0,No Promo,REXONA ANTIBACTERIAL ORIGINAL JABON LIQUIDO EFILL 220ML
20,7791293041865,14,2591.0,No Promo,REXONA ANTIBACTERIAL ORIGINAL JABON LIQUIDO EFILL 220ML
20,7792175001090,14,8235.0,No Promo,PLAC OUT colut.x 200 ml
20,7793742005459,14,21947.0,No Promo,AVENO limpieza gel.x 250 g
20,7793742024627,14,36532.0,No Promo,PROMOCIONAL DERMAGLËS SOLAR F50á EM 380ML FP 50 emuls.fr. x 380 ml
20,7798095717707,14,4080.0,No Promo,MR VINCHA x1u ART.VG07
20,7798140250371,14,18020.0,40%,CICATRICURE Beauty Care cr.x 50 g
20,7798339190068,14,1669.0,No Promo,ESPADOL JABON SKINCARE 80G X1 UNIDAD
20,7891150029309,14,3995.0,No Promo,DOVE NUTRICION LECHE DE COCO JABON LIQUIDO 2 0ML
20,7791519704994,137,2390.0,2x1,ABIEN PAĐUELOS DESCARTABLE  75 UNIDADES
20,7798149753422,137,2390.0,2x1,ABIEN PAĐUELOS DESCARTABLE  75 UNIDADES
20,3337875810869,13,73910.0,No Promo,VICHY IDEAL SOLEIL PROTECTOR SOLAR SPF50+ BE CH PROTECT SPRAY 200ML
20,4005900265227,13,65392.0,No Promo,EUCERIN SOLAR FPS50 FLUIDO ANTIJEDAD cr.x50m
20,4005900985712,13,3764.0,35%,NIVEA WOM BLACK Y WHITE  INVISIBLE FRESH DES DORANTE 150ML
20,4005900994776,13,55501.0,No Promo,EUCERIN SOLUCION FACIAL HYDRO FLUID FPS 50 X 50ML
20,6923700979817,13,5580.0,No Promo,GARNIER 5 MIN AMP MASK PINEAPPLE HZ
20,7500435229845,13,4924.0,25%,PANTENE PRO-V MIRACLES DETOX SHAMPOO 200ML
20,7500435229852,13,4924.0,25%,PANTENE PRO-V MIRACLES DETOX ACONDICONADOR 2 0ML
20,7500435235457,13,8043.0,No Promo,PANTENE PRO-V MIRACLES REVITALIZACION SHAMPO 400ML
20,7500435241069,13,4924.0,25%,PANTENE PRO-V MIRACLES KERATINA REPARA Y PRO EGE SHAMPOO 200ML
20,7509546683393,13,3197.0,No Promo,PALMOLIVE TOQUE NUTRITIVO FRAMBUESA Y MORA J BON 90GR 3 UNIDADES
20,7509552484373,13,10800.0,No Promo,LOREAL HIDRA-TOTAL5 DESMAQ.AGUA MICELAR env. 200ml
20,7509552790191,13,6547.0,40%,ELVIVE DREAM LONG SHAMPOO 400ML
20,7509552836592,13,4063.0,No Promo,ELVIVE DREAM LONG CREMA PARA PEINAR 250ML
20,7509552838954,13,6547.0,40%,ELVIVE DREAM LONG SHAMPOO 400ML
20,7790010002233,13,4248.0,No Promo,SIEMPRE LIBRE ESPECIAL ADAPT SUAVE CON ALAS OALLA FEMENINA 16 UNIDAD
20,7790010002660,13,4248.0,No Promo,SIEMPRE LIBRE ESPECIAL ADAPT SUAVE CON ALAS OALLA FEMENINA 16 UNIDAD
20,7790010669078,13,4248.0,No Promo,SIEMPRE LIBRE ESPECIAL ADAPT SUAVE CON ALAS OALLA FEMENINA 16 UNIDAD
20,7791001011791,13,12153.0,No Promo,BIFERDIL PROTECTOR TERMICO C/AC HIAL ATOM X2 0ML
20,7791293031965,13,915.0,No Promo,REXONA ORCHID JABON 1 UNIDAD 125G
20,7791293032405,13,3066.0,35%,REXONA WOM SKIN CARE NUTRITIVE DESODORANTE 1 0ML
20,7791293038766,13,3153.0,No Promo,DOVE REGENERACION EXTREMA SHAMPOO 200ML
20,7791293041735,13,3066.0,35%,REXONA WOM SKIN CARE NUTRITIVE DESODORANTE 1 0ML
20,7791293041964,13,915.0,No Promo,REXONA ORCHID JABON 1 UNIDAD 125G
20,7791293042190,13,3153.0,No Promo,DOVE REGENERACION EXTREMA SHAMPOO 200ML
20,7791293045566,13,3066.0,35%,REXONA WOM SKIN CARE NUTRITIVE DESODORANTE 1 0ML
20,7791293046525,13,915.0,No Promo,REXONA ORCHID JABON 1 UNIDAD 125G
20,7791293047003,13,3153.0,No Promo,DOVE REGENERACION EXTREMA SHAMPOO 200ML
20,7791293049106,13,915.0,No Promo,REXONA ORCHID JABON 1 UNIDAD 125G
20,7791293049557,13,3066.0,35%,REXONA WOM SKIN CARE NUTRITIVE DESODORANTE 1 0ML
20,7791293050607,13,4144.0,No Promo,AXE MUSK 48HS FRAGANCIA + FRESCURA CANELA Y MBAR DESODORANTE 230ML
20,7791293051000,13,915.0,No Promo,REXONA ORCHID JABON 1 UNIDAD 125G
20,7792175010054,13,14343.0,No Promo,PLAC OUT MANTENIMIENTO env.x 500 ml
20,7798008964037,13,985.0,No Promo,OTOWIL SACHET MINUTO CERO REPARACION sachet 25g 90341
20,7798029269937,13,1405.0,No Promo,PELLIZA PINCEL p/TINTURA x1u ART.1887
20,7798131603070,13,2413.0000000000005,No Promo,INFLUENCIA JABON LIQUIDO FRUTOS DEL BOSQUE 5 0ML
20,7798154630046,13,6500.0,No Promo,BIOCLEAN CREMA SHOCK NUTRITIVO 75GR
20,7798382384582,13,13245.0,No Promo,OTOWIL CERA EN BARRA EFECTO SUAVE Y NATURAL UBO 75GR - 21110
20,7891010251048,13,12817.0,30%,NEUTROGENA HYDROBOOST AGUA MICELAR LOCION 20 ML
20,7891150025998,13,1624.0,No Promo,DOVE BABY SENSIBLE JABON 75GR 1 UNIDAD
20,7899026413665,13,4432.0,No Promo,COLORAMA CREMOSO ESM.x8ml (ROSA ANTIGO)
20,8429420161245,13,60678.0,No Promo,ISDIN HYDRO OIL FOTOPROTECTOR SPF 30  BIFASI O 200ML
20,8718951193642,13,12760.0,No Promo,ELMEX SENSITIVE ENJUAGUE BUCAL 400ML
20,77941923,12,1997.0,20%,REXONA MEN INVISIBLE 48H DESO.ROLL-ON x50ml /T
20,78925472,12,1997.0,20%,REXONA MEN INVISIBLE 48H DESO.ROLL-ON x50ml /T
20,78944794,12,1997.0,20%,REXONA MEN INVISIBLE 48H DESO.ROLL-ON x50ml /T
20,41554081145,12,27413.0,35%,MAYBELLINE NY THE FALSIES SURREAL WASHABLE V RY BLACKJ MASCARA PESTAN
20,70330717510,12,6000.0,No Promo,BIC COMFORT 3 MAQUINA DE AFEITAR 2 UNIDADES 943123
20,70330731745,12,5434.0,No Promo,BIC SOLEIL MAQUINA DE AFEITAR ROSA Y VIOLETA 2 UNIDADES - 930270
20,70942507240,12,3898.0,No Promo,GUM ORTHODONTIC CERA DE ORTODONCIA MENTA VIT E 5 UNIDADES
20,74170450774,12,10690.0,No Promo,SALLY HANSEN HARD AS NAILS STRENGTH ESMx13.3ml Z45077
20,75486031565,12,35459.0,No Promo,HAWAIIAN FPS15 ACEITE BRONCEADOR ACEITE 230M
20,75486088705,12,36463.00000000001,No Promo,HAWAIIAN TROPIC CARROT FPS30 PROTECTOR SOLAR LOCION 240ML
20,3086123549982,12,17000.0,No Promo,BIC SOLEIL CLIC MAQUINA DE AFEITAR CON 5 RES UESTO - 968723
20,3337875757669,12,69120.0,No Promo,LA ROCHE POSAY TOLERIANE DERMALLERGO FLUIDO P/PT 40ML - LR260
20,4895125911036,12,8241.0,No Promo,BASICCARE ENVASES DE VIAJE ART.1103
20,4895125912118,12,10995.0,No Promo,BASICC 1211 PINZA DEPILAR NEGR
20,4895125937395,12,3802.0,No Promo,BASICCARE 3739 MINI BANDITAS ELASTICAS
20,7500435019729,12,9706.0,25%,HEAD & SHOULDERS ANTI COMEZON SHAMPOO 375ML
20,7500435125826,12,6445.0,35%,ALWAYS XTRA DIARIOS PROTECCION SIN PERFUME P OTECTORES DIARIOS 40 UNI
20,7500435138345,12,8105.0,40%,PANTENE PRO-V MIRACLES COLAGENO ACONDICIONAD R 400ML
20,7500435150262,12,7679.0,No Promo,ORAL B EXTRA BLANCO CREMA DENTAL 150GR
20,7500435156509,12,6445.0,35%,ALWAYS XTRA DIARIOS PROTECCION SIN PERFUME P OTECTORES DIARIOS 40 UNI
20,7500435178747,12,6445.0,35%,ALWAYS XTRA DIARIOS PROTECCION SIN PERFUME P OTECTORES DIARIOS 40 UNI
20,7500435187831,12,10070.0,No Promo,GILLETTE PRESTOBARBA 3 COOL MAQUINA 4 UNIDAD S
20,7500435192972,12,6445.0,35%,ALWAYS XTRA DIARIOS PROTECCION SIN PERFUME P OTECTORES DIARIOS 40 UNI
20,7500435229814,12,8043.0,40%,PANTENE PRO-V MIRACLES DETOX ACONDICIONADOR 00ML
20,7500435230117,12,8043.0,40%,PANTENE PRO-V MIRACLES HIDRATA ACONDICIONADO 400ML
20,7500435231237,12,9706.0,25%,HEAD & SHOULDERS ANTI COMEZON SHAMPOO 375ML
20,7500435233057,12,6445.0,35%,ALWAYS XTRA DIARIOS PROTECCION SIN PERFUME P OTECTORES DIARIOS 40 UNI
20,7500435235297,12,8043.0,No Promo,PANTENE PRO-V MIRACLES VOLUMEN SHAMPOO 400ML
20,7500435235396,12,8043.0,No Promo,PANTENE PRO-V MIRACLES LISO INFINITO SHAMPOO 400ML
20,7500435241090,12,4924.0,25%,PANTENE PRO-V MIRACLES KERATINA REPARA Y PRO EGE ACONDICIONADOR 200ML
20,7501843503923,12,12000.0,No Promo,BIC SOLEIL ESCAPE MAQUINA DE AFEITAR ROSAS Y MAGNOLIA 3 UNIDADES - 51
20,7506309841762,12,11743.0,25%,GILLETTE VENUS RECARGABLE maq.x1u(ROSA)
20,7509552805581,12,3279.0,No Promo,GARNIER FRUCTIS RECARGA NUTRITIVA SHAMPOO 20 ML
20,7509552805628,12,3279.0,No Promo,GARNIER FRUCTIS RECARGA NUTRITIVA ACONDICION DOR 200ML
20,7509552816242,12,4403.0,30%,GARNIER FRUCTIS LISO COCO SHAMPOO 350ML
20,7509552823844,12,4403.0,30%,GARNIER FRUCTIS LISO COCO SHAMPOO 350ML
20,7509552823899,12,3279.0,No Promo,GARNIER FRUCTIS RECARGA NUTRITIVA ACONDICION DOR 200ML
20,7509552823905,12,3279.0,No Promo,GARNIER FRUCTIS RECARGA NUTRITIVA SHAMPOO 20 ML
20,7509552843736,12,4063.0,No Promo,ELVIVE DREAM LONG LISS CREMA PARA PEINAR 250 L
20,7509552844405,12,4403.0,30%,GARNIER FRUCTIS GOODBYE DANOS ACONDICIONADOR 350ML
20,7509552845983,12,6547.0,40%,ELVIVE HIDRA HIALURONICO HIDRA RELLENADOR AC NDICIONADOR 400ML
20,7509552849691,12,3279.0,No Promo,GARNIER FRUCTIS RECARGA NUTRITIVA SHAMPOO 20 ML
20,7509552849707,12,3279.0,No Promo,GARNIER FRUCTIS RECARGA NUTRITIVA ACONDICION DOR 200ML
20,7509552890464,12,3279.0,No Promo,GARNIER FRUCTIS HYDRA LISS OLEO DE ARGAN Y K RATINA ACONDICIONADOR 20
20,7509552898255,12,33000.0,No Promo,LOREAL REVITALIFT PRO-RETINOL DIA FPS17 CREM 50GR
20,7509552902358,12,6547.0,40%,ELVIVE HIDRA HIALURONICO HIDRA RELLENADOR AC NDICIONADOR 400ML
20,7509552914030,12,4403.0,30%,GARNIER FRUCTIS GOODBYE DANOS ACONDICIONADOR 350ML
20,7509552920857,12,4403.0,30%,GARNIER FRUCTIS LISO COCO SHAMPOO 350ML
20,7509552922226,12,3279.0,No Promo,GARNIER FRUCTIS RECARGA NUTRITIVA ACONDICION DOR 200ML
20,7509552922288,12,3279.0,No Promo,GARNIER FRUCTIS RECARGA NUTRITIVA SHAMPOO 20 ML
20,7702018983902,12,10070.0,No Promo,GILLETTE PRESTOBARBA 3 COOL MAQUINA 4 UNIDAD S
20,7790010002684,12,5227.0,No Promo,SIEMPRE LIBRE ESPECIAL ADAPT SECA CON ALAS T ALLA FEMENINA 16 UNIDADE
20,7790010436137,12,5227.0,No Promo,SIEMPRE LIBRE ESPECIAL ADAPT SECA CON ALAS T ALLA FEMENINA 16 UNIDADE
20,7790010570893,12,5227.0,No Promo,SIEMPRE LIBRE ESPECIAL ADAPT SECA CON ALAS T ALLA FEMENINA 16 UNIDADE
20,7790375004385,12,14257.0,No Promo,BAGOVIT A Absorcion 1minuto x 350g
20,7790375268411,12,24044.000000000004,No Promo,BAGOVIT SOLAR FAMILY CARE NE FP30 emuls.x 20 ml
20,7791293033471,12,3503.0,No Promo,REXONA EFFICIENT DESO.x88gr(153ml)
20,7791293041001,12,3503.0,No Promo,REXONA EFFICIENT DESO.x88gr(153ml)
20,7791293044460,12,3503.0,No Promo,REXONA EFFICIENT DESO.x88gr(153ml)
20,7791293049861,12,6397.0,40%,TRESEMME BRILLO LAMELAR SHAMPOO 500ML ATOMIZ DOR
20,7793742004384,12,11143.0,No Promo,AVENO jab.x 120 g
20,7794640173219,12,8194.0,No Promo,COREGA TABS PRO ORTODONCIA 30 TABLETA LIMPIE A
20,7796285290740,12,3737.0,25%,EVAGINA toallitas hˇmedas x 20
20,7798008968608,12,985.0,No Promo,OTOWIL CICATRIHAIR KERAT +AC.HIALURONICO env x25g
20,7798029200268,12,4926.000000000001,No Promo,PELLIZA ESPONJA MQUILLAJE esponja x1u ART.02 8
20,7798029278632,12,2284.0,No Promo,PELLIZA PASTILLERO 7863 x1u
20,7798087370002,12,1657.0,No Promo,PELLIZA CLIPS GDE x12u ART.1253
20,7798140258384,12,24044.000000000004,No Promo,BAGOVIT SOLAR FAMILY CARE NE FP30 emuls.x 20 ml
20,7798142356668,12,3404.0,No Promo,GUM MIRACULOUS BUBBLE GEL DENTAL KIDS 100GR
20,7798142356736,12,8250.0,25%,GUM ORTODONCIA GEL DENTAL 100GR
20,7798182770264,12,26000.0,No Promo,CEPAGE FILTRES FLUID COLORS FPS 50+ loc.colo x 50 ml
20,7891010249878,12,29900.0,No Promo,NEUTROGENA BRIGHT BOOST FACIAL FPS30 GEL CR 40gr
20,7891010256166,12,24378.0,35%,NEUTROGENA SUN FRESH HYDRO BOOST TONO MEDIO PS50 CREMA 40ML
20,7891024123485,12,5237.0,No Promo,COLGATE SENSITIVE PRO ALIVIO ORIGINAL CREMA ENTAL 110GR
20,7891024132647,12,5237.0,No Promo,COLGATE SENSITIVE PRO ALIVIO ORIGINAL CREMA ENTAL 110GR
20,7891150061330,12,6397.0,40%,TRESEMME BRILLO LAMELAR SHAMPOO 500ML ATOMIZ DOR
20,8906038782784,12,5999.0,No Promo,SRI SRI BALSAMO LABIAL 10GR
20,42277132,11,10875.0,40%,NIVEA DESMAQUILLANTE BIFASICO DE OJOS EFECTO DUAL 125ML
20,75069216,11,4067.0,40%,REXONA SPORT ANTITRASPIRANTE BARRA X 50GR
20,75076795,11,4067.0,40%,REXONA SPORT ANTITRASPIRANTE BARRA X 50GR
20,41554590913,11,27413.0,35%,MAYBELLINE LASH SENS.SKY HIGH WTP VERY BLACK
20,70942002110,11,4188.0,No Promo,GUM CLASSIC 211 SUAVE + FLOSSERS CEPILLO DEN AL 1 UNIDAD
20,70942306171,11,5894.0,15%,GUM SOFT PICKS MEDIUM PALITOS INTERDENTALES 0 UNIDADES
20,75486020286,11,28945.0,No Promo,HAWAIIAN FPS04 TANNING loc.x240ml
20,785618136289,11,1515.0,No Promo,RENATA PILAS LITIO CR2032 1UNIDAD
20,3337871325787,11,49800.0,No Promo,VICHY IDEAL SOLEI PROTECTOR SOLAR SPF50+ BB OQUE SECO CREMA 50ML
20,3337875597296,11,19875.0,No Promo,CERAVE CREMA DE PIES 89ML
20,3600523409273,11,16127.0,No Promo,LOREAL SUPERLINER LE KHOL 101(MIDNIGHT BLACK)
20,3616304545061,11,13800.0,No Promo,SALLY HANSEN MIRACLE GEL NEON 8ML
20,3616304545078,11,13800.0,No Promo,SALLY HANSEN MIRACLE GEL NEON 8ML
20,3616304545108,11,13800.0,No Promo,SALLY HANSEN MIRACLE GEL NEON 8ML
20,3616304545122,11,13800.0,No Promo,SALLY HANSEN MIRACLE GEL NEON 8ML
20,3616304545139,11,13800.0,No Promo,SALLY HANSEN MIRACLE GEL NEON 8ML
20,3616305519986,11,28035.0,No Promo,RIMMEL LONDON WONDER BOND MASCARA DE PESTANA 001
20,4005808257553,11,2348.0000000000005,25%,NIVEA DRY IMPACT MEN A/T DESO.ROLL-ON x50ml
20,4005900130785,11,2367.0,20%,NIVEA PROTECCTION&CARE WOM DESO.ROLL-ON x50m
20,4895125911043,11,8293.0,No Promo,BASICC 1104 BOTELLAS VIAJE COS
20,6923700977561,11,7200.0,No Promo,GARNIER SKINACTIVE MASC.EN TELA GRANADA sach t x32g
20,7500435184649,11,9243.0,No Promo,PANTENE PRO-V VOLUME MULTIPLIER BAMBU COLAGE O ACONDICIONADOR 235ML
20,7500435191531,11,5726.000000000001,No Promo,PANTENE TRATAMIENTO NOCTURNO COLAGENO AMPOLL 15ML
20,7500435204026,11,22118.0,25%,GILLETTE VENUS SKIN INTIMA  MAQUINA AFEITAR UNIDAD
20,7500435235334,11,8043.0,No Promo,PANTENE PRO-V MIRACLES VOLUMEN ACONDICONADOR 400ML
20,7502235821267,11,7544.0,No Promo,GUM SOFT PICKS COMFORT FLEX MENTA PALITOS IN ERDENTALES 32 UNIDADES
20,7506306241169,11,3778.0,35%,DOVE GO FRESH PEPINO Y TE VERDE DESODORANTE EM 169ML
20,7509546686325,11,5739.0,No Promo,COLGATE PLAX ROJO ENJUAGUE BUCAL 250ML
20,7509546686363,11,7812.0,No Promo,COLGATE PLAX MENTA FRESCA ENJUAGUE BUCAL 500 L
20,7509552790504,11,6547.0,40%,ELVIVE OLEO EXTRAORDINARIO RIZOS DEFINIDOS A ONDICIONADOR 400ML
20,7509552806403,11,7200.0,No Promo,GARNIER SKINACTIVE MASC.EN TELA GRANADA sach t x32g
20,7509552823837,11,3279.0,No Promo,GARNIER FRUCTIS LISO COCO ACONDICIONADOR 200 L
20,7509552827019,11,3279.0,No Promo,GARNIER FRUCTIS LISO COCO ACONDICIONADOR 200 L
20,7509552831016,11,3279.0,No Promo,GARNIER FRUCTIS ALOE HIDRA BOMB ACONDICIONAD R 200ML
20,7509552843088,11,6547.0,40%,ELVIVE DREAM LONG LISS SHAMPOO 400ML
20,7509552843118,11,6547.0,40%,ELVIVE DREAM LONG LISS ACONDICIONADOR 400ML
20,7509552844221,11,5853.0,No Promo,GARNIER FRUCTIS HAIR FOOD AGUACATE ACONDICIO ADOR 300ML
20,7509552849493,11,23650.0,30%,GARNIER EXPRESS ACLARA SERUM X30 ML
20,7509552874099,11,5853.0,No Promo,GARNIER FRUCTIS HAIR FOOD AGUACATE ACONDICIO ADOR 300ML
20,7509552902877,11,5545.0,No Promo,ELVIVE KERA LISO MASCARILLA CAPILAR NUTRI LI S 300GR
20,7509552914542,11,6547.0,40%,ELVIVE OLEO EXTRAORDINARIO RIZOS DEFINIDOS A ONDICIONADOR 400ML
20,7509552920864,11,3279.0,No Promo,GARNIER FRUCTIS LISO COCO ACONDICIONADOR 200 L
20,7509552922301,11,3279.0,No Promo,GARNIER FRUCTIS ALOE HIDRA BOMB ACONDICIONAD R 200ML
20,7509552925913,11,6547.0,40%,ELVIVE OLEO EXTRAORDINARIO RIZOS DEFINIDOS A ONDICIONADOR 400ML
20,7790396103081,11,6243.0,No Promo,HENO DE PRAVIA COLONIA 250ML
20,7791293008134,11,3778.0,35%,DOVE GO FRESH PEPINO Y TE VERDE DESODORANTE EM 169ML
20,7791293040028,11,3778.0,35%,DOVE GO FRESH PEPINO Y TE VERDE DESODORANTE EM 169ML
20,7791293044651,11,6717.0,40%,TRESEMME KERATINE ANTIFRIZZ SHAMPOO 500ML AT MIZADOR
20,7791293046235,11,3778.0,35%,DOVE GO FRESH PEPINO Y TE VERDE DESODORANTE EM 169ML
20,7791293047287,11,5772.0,40%,DOVE HIDRATACION INTENSA SHAMPOO 400ML
20,7791293048475,11,3778.0,35%,DOVE GO FRESH PEPINO Y TE VERDE DESODORANTE EM 169ML
20,7791293049953,11,6717.0,40%,TRESEMME KERATINE ANTIFRIZZ SHAMPOO 500ML AT MIZADOR
20,7791293050324,11,5772.0,40%,DOVE HIDRATACION INTENSA SHAMPOO 400ML
20,7791600049461,11,3200.0,No Promo,PRUNE II DESO.x123ml
20,7792175010023,11,13148.0,20%,PERPIEL HUMECTACION PROFUNDA emuls.c/fraganc a x 400g
20,7793970701000,11,8419.0,No Promo,BABELITO ASPIRADOR NASAL 2 PICOS x1u 70100
20,7795513239872,11,9800.0,40%,DARVITA LAIMA BIO BRUMA EUCALIPTUS 75 ML
20,7795513239971,11,9800.0,25%,DARVITA LAIMA HYDROTHERAPY AGUA DE LAVANDA 1 5ML
20,7795513239995,11,2700.0,25%,DARVITA LAIMA LIMAS X2U
20,7798029000288,11,5466.000000000001,No Promo,PELLIZA 0028B CISNE LATEX TRI x1u
20,7798029278694,11,1258.0,No Promo,PELLIZA 7869 x1u
20,7798122341394,11,8170.0,No Promo,VIASEK GEL VAGINAL pomo x 40 ml
20,7798140257851,11,9292.000000000002,35%,TIO NACHO EFECTO ANTI CANAS SHAMPOO 415ML
20,7798142351205,11,3404.0,No Promo,GUM PAW PATROL BUBBLE GEL DENTAL KIDS 100GR
20,7798142356729,11,7500.0,25%,GUM ANTIBACTERIAL GEL DENTAL 100GR
20,7798178623727,11,26600.0,No Promo,EXIMIA SOLAIRE EXTREME FLUIDE COLOR bomba x 0 g
20,7798178624021,11,25700.0,No Promo,EXIMIA AQUA MAT GEL fco.c/bomba x 190 ml
20,7798178624038,11,25700.0,No Promo,EXIMIA AQUA MAT GEL fco.c/bomba x 190 ml
20,7798187600061,11,8590.0,No Promo,PURA SOAP JABON VEGETAL 1UNIDAD 85GR (NEUTRO
20,7798187600375,11,5690.0,No Promo,PURA SOAP NATURAL LIP BALM SANDIA&MELON lc x u x4g
20,7798187600481,11,8590.0,No Promo,PURA SOAP AVENA & ARGAN JABON X85G
20,7891010256159,11,24378.0,35%,NEUTROGENA SUN FRESH HYDRO BOOST TONO CLARO FPS50 CREMA 40ML
20,7891010256449,11,24378.0,35%,NEUTROGENA SUN FRESH HYDRO BOOST SIN COLOR F S50 CREMA 40ML
20,7891024131183,11,7812.0,No Promo,COLGATE PLAX MENTA FRESCA ENJUAGUE BUCAL 500 L
20,7891150050488,11,5772.0,40%,DOVE HIDRATACION INTENSA SHAMPOO 400ML
20,7891150082656,11,5772.0,40%,DOVE HIDRATACION INTENSA SHAMPOO 400ML
20,7899026486997,11,5545.0,No Promo,ELVIVE KERA LISO MASCARILLA CAPILAR NUTRI LI S 300GR
20,8429420196377,11,52509.0,No Promo,ISDIN FOTOPROTECOR PED.FUSION W.SPF50 50M
