codigo,ean,stock,precio,promo,descripcion
20,41554590500,9,27413.0,35%,MAYBELLINE LASH SENS.SKY HIGH VERY BLACK
20,70942122863,9,5894.0,No Promo,GUM SOFT PICKS ORIGINAL PALILLOS INTERDENTAL 40+5 45 UNIDADES
20,70942304733,9,4183.0,No Promo,GUM FLOSSER ULTRA DESLIZANTE SUAVE HILO DENT L 40 UNIDADES
20,309971879159,9,12290.0,No Promo,REVLON KISS BALM lab.x1u015(JUICYPEACH)
20,650240011290,9,11068.0,35%,GOICOECHEA cr.diabetex x 400 g
20,3337871328795,9,96580.0,No Promo,VICHY LIFTACTIVE SUPREME PNM pote x50ml
20,3337875597272,9,32220.0,No Promo,CERAVE CREMA CONTORNO OJOS 14ML
20,3337875839501,9,70185.0,No Promo,VICHY MINERAL 89 CREMA  RICA 50ML
20,3337875895637,9,70185.0,No Promo,VICHY MINERAL 89 CREMA  RICA 50ML
20,3600523627240,9,4238.0,40%,ELVIVE HIALURONICO PURE HIDRA PURIFICANTE AC NDICIONADOR 200ML
20,3600524057336,9,38515.0,No Promo,LOREAL REVITALIFT RETINOL NOCHE SERUM 30ML
20,4005900036759,9,2348.0000000000005,25%,NIVEA INVISIBLE BLACK&WHITE POWER DESO.ROLL- N x50ml
20,4005900656063,9,57482.0,No Promo,EUCERIN HYALURON FILLER BOOSTER X 30ML
20,4005900839626,9,53789.0,No Promo,EUCERIN OIL CONTROL PROTECTOR SOLAR TONO CLA O FPS50 GEL 50ML
20,4005900942791,9,5831.000000000001,No Promo,CURITAS APOSITO FLEXIBLE XL 10 UNIDADES
20,4005900985828,9,5767.0,2x1,NIVEA MICELAR 4EN1 TOALLITA DESMAQUILLANTE 25uni
20,7500435185240,9,11728.0,25%,GILLETTE MACH3 SENSITIVE MAQUINA 1 UNIDAD
20,7500435188098,9,12266.0,No Promo,PANTENE PRO-V BAMBU VOLUME MULTIPLIER TRATAM ENTO SIN ENJUEGUE 110ML
20,7500435230094,9,8043.0,40%,PANTENE PRO-V MIRACLES HIDRATA Y FORTALECE S AMPOO 400ML
20,7500435233026,9,10766.0,No Promo,ALWAYS  RESPIRABLE SIN PERFUME 80 UNIDADES
20,7506306252820,9,10453.0,30%,DOVE PRO-RETINOL FIRMEZA Y ELASTICIDAD CORPO AL SERUM 200ML
20,7509552790139,9,6547.0,40%,ELVIVE REPARACION TOTAL 5 KERATIN ACONDICION DOR 400ML
20,7509552840322,9,23025.0,30%,LOREAL REVITALIFT AC.HIALURONICO DIA cr.x50m
20,7509552840339,9,24900.0,30%,LOREAL REVITALIFT AC.HIALURONICO NOCHE cr.x5 ml
20,7509552876420,9,4238.0,40%,ELVIVE HIALURONICO PURE HIDRA PURIFICANTE AC NDICIONADOR 200ML
20,7509552902747,9,4238.0,40%,ELVIVE REPARACION TOTAL 5 CALENDULA + CERAMI A ACONDICIONADOR 200ML
20,7509552902815,9,6547.0,40%,ELVIVE REPARACION TOTAL 5 KERATIN ACONDICION DOR 400ML
20,7509552930672,9,35350.0,No Promo,LOREAL PARIS GLYCOLIC BRIGHT SERUM 30ML
20,7702003010798,9,2791.0,No Promo,CURITAS APOSITOS MANIA UNICORNIO 20 UNIDADES
20,7702018037803,9,11728.0,25%,GILLETTE MACH3 SENSITIVE MAQUINA 1 UNIDAD
20,7790010002417,9,5127.0,35%,JOHNSON ORIGINAL  SHAMPOO 200ML
20,7790010003162,9,5127.0,35%,JOHNSON ORIGINAL  SHAMPOO 200ML
20,7790010540131,9,5127.0,35%,JOHNSON ORIGINAL  SHAMPOO 200ML
20,7790010570626,9,5127.0,35%,JOHNSON ORIGINAL  SHAMPOO 200ML
20,7790299003891,9,13760.0,No Promo,ZONO TRAVEL SIZE PROTECTOR SOLAR FPS50 CREMA 90ML
20,7790375269678,9,7675.0,No Promo,BAGOVIT CAPILAR COLOR RADIANTE shampoo x 350 ml
20,7791293031927,9,933.0,No Promo,REXONA SENSIBLE FRESH JABON X1 UNIDAD 125GR
20,7791293041803,9,3711.0,No Promo,REXONA ANTIBACTERIAL ALOE JABON LIQUIDO X 25 ML
20,7791293041926,9,933.0,No Promo,REXONA SENSIBLE FRESH JABON X1 UNIDAD 125GR
20,7791293046488,9,933.0,No Promo,REXONA SENSIBLE FRESH JABON X1 UNIDAD 125GR
20,7791293049069,9,933.0,No Promo,REXONA SENSIBLE FRESH JABON X1 UNIDAD 125GR
20,7791293050966,9,933.0,No Promo,REXONA SENSIBLE FRESH JABON X1 UNIDAD 125GR
20,7792640004533,9,6700.0,No Promo,CAPILA PRODUCTOS ESPECIALES ENGROSADOR AC x4 0ml
20,7793094000478,9,5384.0,No Promo,AULO GELIO REPELENTE cr.x 50 g
20,7793742003264,9,25316.0,No Promo,DERMAGLOS LINEA SOLAR FPS 65 RA crema x 90g
20,7793742004643,9,7955.0,No Promo,DERMAGLOS LINEA SOLAR Post solar gel x 50 g
20,7793742005442,9,17564.0,No Promo,AVENO INFANTIL acond.x 250 ml
20,7793742007897,9,14093.0,No Promo,DERMAGLOS F HID F12 P NORMAL CR 50 GR cr.x 5 g
20,7793742008306,9,11275.0,No Promo,DERMAGLOS HOMBRE AFTERSHAVE EM 100 ML crema 100 ml
20,7793970137625,9,7924.0,No Promo,BABELITO BIBERON x250ml 13762
20,7794066000304,9,6292.0,No Promo,FLUOROGEL TERAPEUTICO Frutilla x 60 g
20,7796285289348,9,10782.000000000002,25%,EVAGINA espuma x 240 ml
20,7798029175450,9,3627.0,No Promo,PELLIZA CISNE LATEX X6 TRIANGULOS
20,7798029261245,9,2898.0000000000005,No Promo,PELLIZA GUANTE EXFOLIANTE x1u ART.1630
20,7798111211707,9,16600.0,No Promo,ACF BY DADATINA BODY SOLUTION TRAT HIDRATACI N CORPORAL 250ML
20,7798131604664,9,2413.0000000000005,No Promo,INFLUENCIA JABON LIQUIDO TE VERDE 500ML
20,7798140251910,9,11068.0,35%,GOICOECHEA cr.diabetex x 400 g
20,7798178623949,9,35200.0,No Promo,EXIMIA HYDRA LEGERE AQUA GEL Airless env.x 5 g
20,7798187600023,9,8590.0,No Promo,PURA SOAP JABON VEGETAL GARDENIA 85GR 1 UNID D
20,7798187600245,9,5690.0,25%,PURA SOAP NATURAL LIP BALM RASPBERRY lc x1u 4g
20,7798187601037,9,11590.0,No Promo,PURA SOAP DESODORANTE AVENA  SIN ALUMINIO RO L
20,7798187601143,9,7300.0,25%,PURA SOAP CHERRY BALSAMO LABIAL 3.5
20,7798361140277,9,9950.0,No Promo,VGREEN CALM HERBAL LAVANDA  + ACEITES ESENCI LES SPRAY CORPORAL 75ML
20,7798361140529,9,4600.0,No Promo,VGREEN VEGAN FRUTILLA BALSAMO LABIAL 5GR
20,7891010035976,9,1664.0,No Promo,JOHNSON BABY c/GLICERINA JBON x80g
20,7891010669843,9,1664.0,No Promo,JOHNSON BABY c/GLICERINA JBON x80g
20,7891150061767,9,3711.0,No Promo,REXONA ANTIBACTERIAL ALOE JABON LIQUIDO X 25 ML
20,7898587761925,9,4238.0,40%,ELVIVE REPARACION TOTAL 5 CALENDULA + CERAMI A ACONDICIONADOR 200ML
20,7898587761987,9,6547.0,40%,ELVIVE REPARACION TOTAL 5 KERATIN ACONDICION DOR 400ML
20,7899026400559,9,4432.0,No Promo,COLORAMA CREMOSO ESM.x8ml (BLACK)
20,7899706197762,9,21600.0,30%,LOREAL UV DEFENDER FLUIDO CLARA 40G
20,7899706197786,9,21600.0,30%,LOREAL UV DEFENDER FLUIDO MEDIA 40G EXP
20,8429420192263,9,60678.0,No Promo,ISDIN FOTO HYDRO LOTION PROTECT Y DETOX 50 2 0ML
20,8429420248977,9,52981.0,No Promo,ISDIN FOTO FUSION WATER MAGIC 5 STARS SPF50 0 ML
20,8809192702684,9,19699.000000000004,No Promo,DARVITA COONY MASCARILLA FOOT PEELING PIES
20,7891150095618,83,1539.0,3x2,DOVE PIEL SENSIBLE JABON 90GR 1 UNIDAD
20,78926523,8,1997.0,20%,REXONA WOM ACTIVE EMOTION ROLLON 50ML
20,78944848,8,1997.0,20%,REXONA WOM ACTIVE EMOTION ROLLON 50ML
20,41554493856,8,24502.0,35%,MAYBELLINE COLOSSAL VOLUMEN EXPRESS BIG SHOT MASC.WTP(VERYBLACK)
20,70501051054,8,6079.0,No Promo,NEUTROGENA LIMPIEZA toa.x25u
20,74170451092,8,11760.0,No Promo,SALLY HANSEN DOUBLE DUTY BASE&BRILLO PROTEC. env.x13.3ml Z45109
20,79400301161,8,8611.0,No Promo,REXONA CLINICAL WOM ANTI TRANSPIRANTE EXTRA RY BARRA 48GR
20,99176316565,8,3771.0,No Promo,COLGATE MAX WHITE MEDIO 2X1 CEPILLO DENTAL 2 UNIDADES
20,779628528933,8,7486.0,No Promo,EVAGINA gel pomo x 50 ml
20,3337872411991,8,68125.0,No Promo,LA ROCHE POSAY EFFACLAR GEL 400ML - LR33
20,3337875839624,8,70185.0,No Promo,VICHY MINERAL 89 CREMA SIN FRAGANCIA 50ML
20,3600523897308,8,28120.0,No Promo,LOREAL PARADISE 02 BA6ML NU 260
20,4005900713636,8,21700.0,40%,NIVEA FACIAL CELULAR LIFT NOCH 50ML CRE
20,4005900906083,8,65392.0,No Promo,EUCERIN PIGMENT CONTROL TINTED tono medio
20,4895125910329,8,9894.0,No Promo,BASICCARE ENRULA PESTAA x1u ART.1032
20,4895125916949,8,5173.0,No Promo,BASICCARE ESPOJA LIMPIDORA esponja x2u 1694
20,7500435012089,8,7144.0,No Promo,PANTENE PRO-V MIRACLES RESTAURACION ACONDICI NADOR 400ML
20,7500435109093,8,5734.0,No Promo,ORAL B ANTICARIES CREMA DENTAL 150GR
20,7500435124638,8,5734.0,No Promo,ORAL B ANTICARIES CREMA DENTAL 150GR
20,7500435147507,8,8455.0,No Promo,HEAD & SHOULDERS PROTECCION CAIDA ACONDICION DOR 300ML
20,7500435155922,8,7144.0,No Promo,PANTENE PRO-V BAMBU ACONDICIONADOR 400ML
20,7500435168052,8,7144.0,No Promo,PANTENE PRO-V BAMBU ACONDICIONADOR 400ML
20,7500435168441,8,7144.0,No Promo,PANTENE PRO-V MIRACLES RESTAURACION ACONDICI NADOR 400ML
20,7500435176392,8,7144.0,No Promo,PANTENE PRO-V MIRACLES RESTAURACION ACONDICI NADOR 400ML
20,7500435211857,8,7144.0,No Promo,PANTENE PRO-V MIRACLES RESTAURACION ACONDICI NADOR 400ML
20,7500435212465,8,7144.0,No Promo,PANTENE PRO-V BAMBU ACONDICIONADOR 400ML
20,7500435230070,8,4924.0,25%,PANTENE PRO-V MIRACLES HIDRATA ACONDICIONADO 200ML
20,7500435230100,8,4924.0,25%,PANTENE PRO-V MIRACLES HIDRATA Y FORTALECE S AMPOO 200ML
20,7500435233033,8,5158.0,No Promo,ALWAYS LINERS PLUS RESPIRABLE 40 PRO DIA
20,7501054550044,8,3210.0,No Promo,CURITAS APOSITOS MARVEL AVENGERS 20 UNIDADES
20,7506306252837,8,10453.0,30%,DOVE NICINAMIDA TONO UNIFORME CORPORAL SERUM 200ML
20,7506309864839,8,9362.000000000002,No Promo,GILLETTE ENDURANCE COOL WAVE A/T DESO.x150ml
20,7506309877792,8,7144.0,No Promo,PANTENE PRO-V MIRACLES RESTAURACION ACONDICI NADOR 400ML
20,7509546651057,8,6107.0,No Promo,COLGATE LUMINOUS WHITE CARBON ACTIVADO CREMA DENTAL 90GRS
20,7509546673042,8,4147.0,No Promo,COLGATE ZIGZAG CARBON CEPILLO DENTAL 2 UNIDA ES
20,7509546685861,8,1300.0,No Promo,COLGATE KIDS FRUTILLA +6 CREMA DENTAL 50GR
20,7509552790160,8,6547.0,40%,ELVIVE DREAM LONG ACONDICIONADOR 400ML
20,7509552791365,8,4238.0,40%,ELVIVE REPARACION TOTAL EXTREME SHAMPOO 200M
20,7509552815269,8,4989.0,40%,ELVIVE COLOR VIVE MATIFICADOR VIOLETA SHAMPO 200ML
20,7509552823875,8,4403.0,30%,GARNIER FRUCTIS RECARGA NUTRITIVA ACONDICION DOR 350ML
20,7509552838961,8,6547.0,40%,ELVIVE DREAM LONG ACONDICIONADOR 400ML
20,7509552845976,8,4238.0,40%,ELVIVE HIDRA HIALURONICO HIDRA RELLENADOR AC NDICIONADOR 200ML
20,7509552849721,8,4403.0,30%,GARNIER FRUCTIS RECARGA NUTRITIVA ACONDICION DOR 350ML
20,7509552874082,8,5853.0,No Promo,GARNIER FRUCTIS HAIR FOOD SANDIA SHAMPOO 300 L
20,7509552902341,8,4238.0,40%,ELVIVE HIDRA HIALURONICO HIDRA RELLENADOR AC NDICIONADOR 200ML
20,7509552902402,8,4238.0,40%,ELVIVE REPARACION TOTAL EXTREME SHAMPOO 200M
20,7509552914429,8,4403.0,30%,GARNIER FRUCTIS RECARGA NUTRITIVA ACONDICION DOR 350ML
20,7509552922233,8,4403.0,30%,GARNIER FRUCTIS RECARGA NUTRITIVA ACONDICION DOR 350ML
20,7702425808058,8,4406.0,35%,KOTEX TAMPON DIGITAL SUPER 12 UNIDADES
20,7730188270225,8,7890.0,20%,DR SELBY AFTER SHAVE BALSAMO 100GR
20,7790010002288,8,7788.0,No Promo,CAREFREE PROTECCION X 60 UNIDADES
20,7790010002516,8,5127.0,No Promo,JOHNSON BABY ORIGINAL AC 200M
20,7790010002547,8,5299.0,No Promo,JOHNSON FRAGANCIA PROLONGADA SHAMPOO X200ML
20,7790010002882,8,7788.0,No Promo,CAREFREE PROTECCION X 60 UNIDADES
20,7790010002943,8,5847.0,No Promo,JOHNSON BABY ACEITE PURO 100ML
20,7790010003261,8,5127.0,No Promo,JOHNSON BABY ORIGINAL AC 200M
20,7790010003292,8,5299.0,No Promo,JOHNSON FRAGANCIA PROLONGADA SHAMPOO X200ML
20,7790010540223,8,5127.0,No Promo,JOHNSON BABY ORIGINAL AC 200M
20,7790010616799,8,7788.0,No Promo,CAREFREE PROTECCION X 60 UNIDADES
20,7790010668514,8,5127.0,No Promo,JOHNSON BABY ORIGINAL AC 200M
20,7790010959780,8,5847.0,No Promo,JOHNSON BABY ACEITE PURO 100ML
20,7790375260941,8,10917.000000000002,No Promo,BAGOVIT A Classic cr.x 100 g
20,7790375267766,8,17751.0,No Promo,BAGOVIT SOLAR Post sol.Aloe80%gelx200g
20,7790375268213,8,21279.000000000004,No Promo,BAGOVIT FACIAL PRO BIO Cr.noche x 55 g
20,7790416018609,8,3790.0,No Promo,CUTEX QUITAESMALTE FORTALECEDOR 200ML
20,7791001003611,8,10009.0,No Promo,BIF CHAMPU NEUT.ALGAS x400
20,7791001010381,8,1642.0,No Promo,BIFERDIL GLYCOCERAMIDAS Y MULTIVITAMINAS CAP SULAS 2ML
20,7791293005010,8,5772.0,40%,DOVE RECONSTRUCCION COMPLETA SHAMPOO 400ML
20,7791293041438,8,5560.0,No Promo,DOVE RITUAL FORTALECIMEINTO PALTA ACONDICION DOR 400ML
20,7791293041445,8,5560.0,No Promo,DOVE RITUAL FORTALECIMEINTO PALTA ACONDICION DOR 400ML
20,7791293042169,8,5772.0,40%,DOVE RECONSTRUCCION COMPLETA SHAMPOO 400ML
20,7791293043685,8,5772.0,40%,DOVE LARGOS FUERTES Y FLEXIBLES ACONDICIONAD R 400ML
20,7791293044750,8,6717.0,40%,TRESEMME KERATINA ANTIFRIZZ ACONDICIONADOR 5 0ML ATOMIZADOR
20,7791293045238,8,5560.0,No Promo,DOVE RITUAL FORTALECIMEINTO PALTA ACONDICION DOR 400ML
20,7791293045351,8,5772.0,40%,DOVE RECONSTRUCCION COMPLETA SHAMPOO 400ML
20,7791293046853,8,4740.0,No Promo,DOVE SUPER FACTOR NUTRIC ACONDICIONADOR 50 170ML
20,7791293047102,8,5772.0,40%,DOVE RECONSTRUCCION COMPLETA SHAMPOO 400ML
20,7791293047188,8,5772.0,40%,DOVE NUTRICION OLEO MICELAR SHAMPOO 400ML
20,7791293047485,8,5560.0,No Promo,DOVE RITUAL FORTALECIMEINTO PALTA ACONDICION DOR 400ML
20,7791293047560,8,5772.0,40%,DOVE LARGOS FUERTES Y FLEXIBLES ACONDICIONAD R 400ML
20,7791293049960,8,6717.0,40%,TRESEMME KERATINA ANTIFRIZZ ACONDICIONADOR 5 0ML ATOMIZADOR
20,7791293050348,8,5772.0,40%,DOVE NUTRICION OLEO MICELAR SHAMPOO 400ML
20,7791293050362,8,5772.0,40%,DOVE LARGOS FUERTES Y FLEXIBLES ACONDICIONAD R 400ML
20,7792175009799,8,18703.0,20%,PERPIEL ABSORCION INMEDIATA emuls.s/fraganci x 400g
20,7793094000010,8,4895.0,No Promo,REP REPELENTE LOCION 150ML
20,7793742003707,8,28979.0,No Promo,DERMAGLOS LINEA SOLAR FPS 80 cr.x 90 g
20,7793742004872,8,25080.0,No Promo,DERMAGLOS POST SOLAR EM 300 ML Post solar em l. x 300 g
20,7793742005039,8,11537.000000000002,No Promo,DERMAGLOS F LECHE LIMP 200 ML leche x 200 ml
20,7793742007309,8,24431.0,No Promo,DERMAGLOS F ROSACEA emulsižn x 50 ml
20,7794066000014,8,7999.0,2x1,FLUOROGEL ORIGINAL Menta x 60 g
20,7795513240069,8,14990.0,40%,DARVITA LAIMA CREMA EXFOLIANTE ANTICELULEICA 500GR
20,7796285289331,8,7486.0,No Promo,EVAGINA gel pomo x 50 ml
20,7798095716663,8,2169.0,No Promo,MR GOMITAS X4 HG204/3
20,7798140253952,8,13172.0,35%,GOICOECHEA criolip.3D gel x 200 ml
20,7798140255024,8,25201.0,40%,CICATRICURE Cr.Antiedad Tricure x50g
20,7798140256137,8,16452.0,40%,TRIATOP BY MEDICASP shamp.reparac. x 400 ml
20,7798187601044,8,11590.0,No Promo,PURA SOAP DESODORANTE NEUTRO SIN ALUMINIO RO L
20,7798332020515,8,4100.0,No Promo,BOOS INTENSE ROSE WOM DESODORANTE 127ML
20,7798336944114,8,49990.0,No Promo,CHER ONYX EDP 100ML
20,7798361140260,8,9950.0,No Promo,VGREEN EUCALIPTUS + ACEITES ESENCIALE SPRAY ORPORAL 75ML
20,7798361140536,8,4600.0,No Promo,VGREEN VEGAN COCONUT PASSION BALSAMO LABIAL GR
20,7798361140543,8,4600.0,No Promo,VGREEN VEGAN FRESH MELON BALSAMO LABIAL 5GR
20,7798382380283,8,5634.0,No Promo,OTOWIL ACEITE DE COCO CON QUINOA FRASCO 60ML
20,7798382382083,8,5634.0,No Promo,OTOWIL ACEITE DE COCO CON QUINOA FRASCO 60ML
20,7799075001717,8,44780.0,No Promo,AVENE CLEANANCE WOMEN CUIDADO DE NOCHE CREMA 30ML
20,7799075002332,8,44285.0,No Promo,AVENE SOLAR FLUIDO FPS50 CON COLOR TRIASORB 0ML
20,7891024034095,8,1300.0,No Promo,COLGATE KIDS FRUTILLA +6 CREMA DENTAL 50GR
20,7891150053090,8,5560.0,No Promo,DOVE RITUAL FORTALECIMEINTO PALTA ACONDICION DOR 400ML
20,7891150055223,8,5772.0,40%,DOVE NUTRICION OLEO MICELAR SHAMPOO 400ML
20,7891150060869,8,4740.0,No Promo,DOVE SUPER FACTOR NUTRIC ACONDICIONADOR 50 170ML
20,7891150082663,8,5772.0,40%,DOVE NUTRICION OLEO MICELAR SHAMPOO 400ML
20,7891150094482,8,7457.0,No Promo,TRESEMME FINISHER OLEO 60ML
20,7891350040494,8,2900.0,3x2,RISQUE ESMALTE CREMOSO SE SOLTA NO BLUES 8ML
20,7898587772518,8,4238.0,40%,ELVIVE REPARACION TOTAL EXTREME SHAMPOO 200M
20,7898636190706,8,24910.0,40%,CICATRICURE ACLARANTE VIT C Serum x 30 ml
20,7899026405004,8,4432.0,No Promo,COLORAMA CREMOSO ESM.x8ml (VIA LACTEA)
20,8429420218673,8,47868.00000000001,No Promo,ISDIN FOTOPROTECTOR 50+ BODY FUSION gel x50m
20,8429420226272,8,52981.0,No Promo,ISDIN FOTOPROTECTOR FUSION WATER COLOR BRONZ SPF 50+ 50ML
20,8470001631695,8,47868.00000000001,No Promo,ISDIN FOTOPROTECTOR 50+ BODY FUSION gel x50m
20,8470001699664,8,46817.0,No Promo,ISDIN FOTOPROTECTOR 50+ DRYTOUCH s/COLOR + g l cr.x50ml
20,8904150126844,8,1399.0000000000002,No Promo,SRI SRI PREMIUM SAHUMERIOS DELICIA DE PATCHO LI INCENSE 20GR
20,8904150126882,8,1399.0000000000002,No Promo,SRI SRI PREMIUM SAHUMERIOS CANERA INCENSE 20 R
20,8904150126929,8,1399.0000000000002,No Promo,SRI SRI PREMIUM SAHUMERIOS SURYA INCENSE 20G
20,8906038783224,8,3999.0,No Promo,SRI SRI SUDANTA AYURVEDICA LIBRE DE  FLUOR P STA DENTAL 50GR
20,8906038785495,8,1399.0000000000002,No Promo,SRI SRI PREMIUM SAHUMERIOS CHAMPA INCENSE 20 R
20,8906038789479,8,14999.0,No Promo,SRI SRI SUDANTA DENTAL AYURVEDICA SIN FLUOR ENTA GEL 200GR
20,7790396104095,74,2352.0,3x2,HENO DE PRAVIA JABON 100GR 1 UNIDAD
20,7791293022505,74,3066.0,35%,REXONA MEN HOMBRE ANTI TRANSPIRANTE DESODORA TE 150ML
20,7791293041698,74,3066.0,35%,REXONA MEN HOMBRE ANTI TRANSPIRANTE DESODORA TE 150ML
20,7791293045115,74,3066.0,35%,REXONA MEN HOMBRE ANTI TRANSPIRANTE DESODORA TE 150ML
20,7791293049502,74,3066.0,35%,REXONA MEN HOMBRE ANTI TRANSPIRANTE DESODORA TE 150ML
20,7509552849509,7,5853.0,No Promo,GARNIER FRUCTIS HAIR FOOD SANDIA SHAMPOO 300 L
20,77974457,7,1678.0,No Promo,REXONA ODORONO CREMA 60GR
20,77987983,7,1678.0,No Promo,REXONA ODORONO CREMA 60GR
20,41554209440,7,18794.000000000004,No Promo,MAYBELLINE EBONY BLACK
20,70942005210,7,5843.0,No Promo,GUM DEFENSE DUAL HILO DENTAL 35M
20,74170435061,7,15450.0,No Promo,SALLY HANSEN COMPLETE CARE 7EN1 TRAT.x13.3ml ART.43506
20,74170450958,7,12690.0,No Promo,SALLY HANSEN DIAMOND STRENGTH NAIL HARDENER ESMxx13.3ml Z45095
20,74170450996,7,15450.0,No Promo,SALLY HANSEN COMPLETE CARE 7EN1 TRAT.x13.3ml ART.43506
20,309970093648,7,22900.0,20%,REVLON PERFECT AND SMOOTH PRIMER
20,309970175177,7,18290.0,No Promo,REVLON COLORSTAY MATTE LITE CRAYON 011 TRANS ENDANCE
20,309971370427,7,3790.0,No Promo,CUTEX QUITAESMALTE HIPOALARGENICO  200ML
20,736372523723,7,5400.0,No Promo,LAIMA ESMALTE LIME 52
20,3433422406599,7,63820.0,No Promo,LA ROCHE POSAY TOLERIANE DESMAQUILLANTE 200M -LR169
20,3600521961216,7,25943.0,No Promo,LOREAL VOLUMEN MILLION WP
20,4005800005541,7,69285.0,No Promo,EUCERIN SOLAR FPS50 TRANSPARENTE spr.x200ml
20,4005900399946,7,10083.0,40%,NIVEA BODY LOC.COPORAL VAINILLA loc.x400ml
20,4005900901361,7,3147.0,No Promo,NIVEA DRY FRESH AERO 150ML DEO
20,4895125910848,7,7162.0,No Promo,BASICC 1084 PULID.UNAS 4 USOS
20,4895125921301,7,6220.0,No Promo,BASICCARE PIEDRA POMEZ NATURAL x1u ART.2130
20,6902395806479,7,29010.0,No Promo,MAYBELLINE FIT ME ULTMT TWC SPF 128 ASJP
20,7500435138222,7,4961.000000000001,25%,PANTENE PRO-V MIRACLES COLAGENO ACONDICIONAD R 200ML
20,7500435167833,7,6388.0,No Promo,ALWAYS MAXPROT NORMAL DIA SECA c/A toa.x16u
20,7500435178860,7,6388.0,No Promo,ALWAYS MAXPROT NORMAL DIA SECA c/A toa.x16u
20,7500435193061,7,6388.0,No Promo,ALWAYS MAXPROT NORMAL DIA SECA c/A toa.x16u
20,7500435198110,7,10661.0,No Promo,GILLETTE MACH3 EXTRA MAQUINA 1UNIDAD
20,7500435202695,7,9706.0,25%,HEAD & SHOULDERS ACEITE ARGAN  SHAMPOO 375ML
20,7500435204781,7,9851.0,No Promo,ORAL B COMPLETE 4EN1 CREMA DENTAL 180GR
20,7500435229586,7,6388.0,No Promo,ALWAYS MAXPROT NORMAL DIA SECA c/A toa.x16u
20,7500435240987,7,8043.0,40%,PANTENE PRO-V MIRACLES KERATINA REPARA Y PRO EGE ACONDICIONADOR 400ML
20,7501027232311,7,22650.0,No Promo,LOREAL REVITALIFT DIA c/ELASTINA cr.x50ml
20,7501843502919,7,15000.0,No Promo,BIC FLEX 3 HYBRID SENSITIVE MAQUINA DE AFEIT R CON 5 RESPUESTOS - 971
20,7506306249974,7,3846.0,40%,AXE AQUA CITRUS DESODORANTE 150ML
20,7506306252851,7,14518.0,30%,DOVE HIALURONICO PIEL SECA Y EXTRA SECA CORP RAL SERUM 400ML
20,7506306252875,7,17422.0,30%,DOVE NIACINAMIDA TONO UNIDORME CORPORAL SERU 400ML
20,7506306252882,7,17422.0,30%,DOVE PRO-RETINOL FIRMEZA Y ELASTICIDAD CORPO AL SERUM 400ML
20,7506339391541,7,6388.0,No Promo,ALWAYS MAXPROT NORMAL DIA SECA c/A toa.x16u
20,7509546683409,7,3197.0,No Promo,PALMOLIVE RENOVACION HUMECTANTE ALGA Y ACEIT ALMENDRAS JABON 90GR 3
20,7509552193831,7,4238.0,40%,ELVIVE REPARACION TOTAL 5 KERATIN SHAMPOO 20 ML
20,7509552790559,7,6547.0,40%,ELVIVE KERA LISO NUTRI LISS SHAMPOO 400ML
20,7509552791402,7,4238.0,40%,ELVIVE OLEO EXTRAORDINARIO RIZOS DEFINIDOS A ONDICIONADOR 200ML
20,7509552805383,7,3279.0,No Promo,GARNIER FRUCTIS GOODBYE DANOS ACONDICIONADOR 200ML
20,7509552823912,7,3279.0,No Promo,GARNIER FRUCTIS GOODBYE DANOS ACONDICIONADOR 200ML
20,7509552828078,7,5922.0,No Promo,GARNIER FRUCTIS HAIR FOOD BANANA FUERZA MASC RILLA FUERZA 1M 350ML
20,7509552836554,7,4238.0,40%,ELVIVE DREAM LONG ACONDICIONADOR 200ML
20,7509552838947,7,4238.0,40%,ELVIVE DREAM LONG ACONDICIONADOR 200ML
20,7509552847970,7,5545.0,No Promo,ELVIVE HIDRA HIALURONICO CTT 300ML
20,7509552874020,7,5922.0,No Promo,GARNIER FRUCTIS HAIR FOOD BANANA FUERZA MASC RILLA FUERZA 1M 350ML
20,7509552902389,7,5545.0,No Promo,ELVIVE HIDRA HIALURONICO CTT 300ML
20,7509552902532,7,4238.0,40%,ELVIVE REPARACION TOTAL 5 KERATIN SHAMPOO 20 ML
20,7509552902846,7,6547.0,40%,ELVIVE KERA LISO NUTRI LISS SHAMPOO 400ML
20,7509552914535,7,4238.0,40%,ELVIVE OLEO EXTRAORDINARIO RIZOS DEFINIDOS A ONDICIONADOR 200ML
20,7509552925906,7,4238.0,40%,ELVIVE OLEO EXTRAORDINARIO RIZOS DEFINIDOS A ONDICIONADOR 200ML
20,7702018001071,7,10661.0,No Promo,GILLETTE MACH3 EXTRA MAQUINA 1UNIDAD
20,7702632955026,7,1966.0,No Promo,PELLIZA PEINE BOLSILLO DIENTE FINO CAREY bli t.x1u 5241
20,7790010002448,7,4653.0,35%,JOHNSON BABY CABEZA HASTA LOS PIES BANO LIQU DO 200ML
20,7790010003193,7,4653.0,35%,JOHNSON BABY CABEZA HASTA LOS PIES BANO LIQU DO 200ML
20,7790010540063,7,4653.0,35%,JOHNSON BABY CABEZA HASTA LOS PIES BANO LIQU DO 200ML
20,7790010596299,7,4653.0,35%,JOHNSON BABY CABEZA HASTA LOS PIES BANO LIQU DO 200ML
20,7790371000053,7,6121.000000000001,No Promo,VIDOL TALCO CLASICC 200GR
20,7790375268824,7,6888.0,No Promo,BAGOVIT A MANOS Y UĐAS Cr.x 50 g
20,7790416018616,7,3790.0,No Promo,CUTEX QUITAESMALTE HIPOALARGENICO  200ML
20,7791001003529,7,12815.0,No Promo,BIFERDIL 1007 POTENCIA gel x400ml
20,7791001003598,7,10504.0,No Promo,BIFERDIL NUTRI c/VIT.E SH x400ml
20,7791001009811,7,10808.0,No Promo,BIFERDIL LINEA ESPECIFICA Acond.Vit.s/enj.x 00 ml
20,7791293022819,7,4020.0,No Promo,DOVE INVISIBLE DRY DESOSOTANTE MEN 150ML
20,7791293025810,7,3846.0,40%,AXE AQUA CITRUS DESODORANTE 150ML
20,7791293033266,7,3778.0,35%,DOVE GO FRESH VERBENA ANTITRANSPIRANTE DESOD RANTE 150ML
20,7791293033396,7,6717.0,40%,TRESEMME ONDAS BOHO ACONDICIONADOR 500ML ATO IZADOR
20,7791293035963,7,2651.0,No Promo,PATRICHS AVIATOR DESODORANTE MASCULINO 150ML
20,7791293036045,7,2149.0,No Promo,REXONA WOM STAY FRESH POMELO&VERBENA DESO.x1 0ml
20,7791293040042,7,3778.0,35%,DOVE GO FRESH VERBENA ANTITRANSPIRANTE DESOD RANTE 150ML
20,7791293041759,7,2149.0,No Promo,REXONA WOM STAY FRESH POMELO&VERBENA DESO.x1 0ml
20,7791293042978,7,4248.0,No Promo,SEDAL JENGIBRE Y RICINO SHAMPOO 340ML
20,7791293043265,7,4020.0,No Promo,DOVE INVISIBLE DRY DESOSOTANTE MEN 150ML
20,7791293044668,7,6397.0,40%,TRESEMME CAUTERIZACION REPARADORA SHAMPOO 50 ML ATOMIZADOR
20,7791293044866,7,6397.0,40%,TRESEMME CAUTERIZACION REPARADORA SHAMPOO 50 ML ATOMIZADOR
20,7791293045139,7,2149.0,No Promo,REXONA WOM STAY FRESH POMELO&VERBENA DESO.x1 0ml
20,7791293046259,7,3778.0,35%,DOVE GO FRESH VERBENA ANTITRANSPIRANTE DESOD RANTE 150ML
20,7791293046792,7,2651.0,No Promo,PATRICHS AVIATOR DESODORANTE MASCULINO 150ML
20,7791293047539,7,6061.000000000001,40%,DOVE BRILLO OLEO MICELAR ACONDICIONADOR 400M
20,7791293047836,7,4248.0,No Promo,SEDAL JENGIBRE Y RICINO SHAMPOO 340ML
20,7791293048031,7,4020.0,No Promo,DOVE INVISIBLE DRY DESOSOTANTE MEN 150ML
20,7791293048499,7,3778.0,35%,DOVE GO FRESH VERBENA ANTITRANSPIRANTE DESOD RANTE 150ML
20,7791293050034,7,6397.0,40%,TRESEMME CAUTERIZACION REPARADORA SHAMPOO 50 ML ATOMIZADOR
20,7791293050201,7,6717.0,40%,TRESEMME ONDAS BOHO ACONDICIONADOR 500ML ATO IZADOR
20,7791293050379,7,6061.000000000001,40%,DOVE BRILLO OLEO MICELAR ACONDICIONADOR 400M
20,7791600092641,7,3200.0,No Promo,CAROCUORE AMORE DEO X123ML
20,7791600154479,7,6500.0,No Promo,CIEL NOIR  COLONIA 250ML
20,7791600596576,7,3950.0,No Promo,KEVIN ABSOLUTE DESODORANTE 250ML
20,7792175001151,7,16809.0,No Promo,PLAC OUT colut.x 500 ml
20,7792175001922,7,7536.0,No Promo,FLUORDENT PX COLUTORIO fco.x 200 ml
20,7792175010481,7,17797.0,20%,PERPIEL ANTIAGE EFECTO REJUVENECEDOR emuls.c rporal x 400 g
20,7792183000023,7,6926.0,No Promo,SQUAM cr.dental x 80 g
20,7792183001761,7,5607.0,No Promo,SQUAM DOBLE FLUOR env.x 60 g
20,7792640001167,7,6700.0,No Promo,CAPILA P.RUB.AC.ILUMIN. x420
20,7792640001365,7,4500.0,No Promo,CAPILA TRAT.PURO RUBIO x200
20,7792640001815,7,6700.0,No Promo,CAPILATIS LINEA KERATINA DAO EXTREMO AC x350 l
20,7792640003031,7,6810.0,No Promo,CAPILATIS SHAMPOO STOP FRIZZ C-STYLE
20,7792640007060,7,5900.0,No Promo,CAPILATIS LINEA PROTECCION BRILLO Y VOLUMEN CONDICIONADOR 400ML
20,7792640008036,7,8100.0,No Promo,CAPILATIS BALSAMO PH EXTRA ACIDO PROTEGE EL OLOR X350ML
20,7793487075120,7,9500.0,No Promo,SAINT JULIEN PETIT ENFANT BEBES pvo.fecula x 50g 7512
20,7794626006371,7,15590.0,No Promo,PLENITUD FEMME NORMAL PLUS ANTIBACTERIAL 16 NIDADES
20,7794626010880,7,15590.0,No Promo,PLENITUD FEMME NORMAL PLUS ANTIBACTERIAL 16 NIDADES
20,7794640171420,7,7452.0,No Promo,COREGA TABS tab.limp.x 30
20,7794640173028,7,7452.0,No Promo,COREGA TABS tab.limp.x 30
20,7795513240168,7,5400.0,25%,LAIMA ENDURECEDOR T07
20,7795513240243,7,5400.0,25%,Laima Negro
20,7795513240311,7,5400.0,25%,Laima Rosa Quartz
20,7796285279493,7,11523.0,No Promo,CALADRYL CUIDADOS INTENSIVOS PIEL SENSIBLE e ul.x corp. 400 ml
20,7798029078430,7,3195.0,No Promo,PELLIZA LIMA ACOLCHADA M 7843 x1u
20,7798029265137,7,2755.0,No Promo,PELLIZA PERFILADOR DE CEJAS
20,7798029265618,7,2836.0,No Promo,PELLIZA CORTAUA GDE x1u ART.7561
20,7798029283568,7,4419.0,No Promo,PELLIZA COSTAPASTILLA BLANCO x1u 8356
20,7798032936765,7,7699.0,30%,FLUOROGEL JUNIOR Tutti Frutti x 60 g
20,7798032936775,7,7699.0,30%,FLUOROGEL JUNIOR Tutti Frutti x 60 g
20,7798095714997,7,5278.0,No Promo,MR GOMITAS x3u ART.G3G2
20,7798131603025,7,1610.0,No Promo,INFLUENCIA JABON LIQUIDO FRUTOS DEL BOSQUE 2 0ML
20,7798131603087,7,2413.0000000000005,No Promo,INFLUENCIA JABON LIQUIDO FRUTOS ROJOS 500ML
20,7798140256274,7,18121.0,40%,CICATRICURE EyeCream ForFace x 30 g
20,7798140257554,7,2990.0,35%,TEATRICAL Humect.v2 cr.x 100 g
20,7798173570088,7,28400.0,No Promo,ECOHAIR PESTAĐAS gel x 5 ml
20,7798175718792,7,38400.0,No Promo,BOOS INTENSE LUMIERE WOM EDP 90ML
20,7798187601013,7,9890.0,No Promo,PURA SOAP BODY MIST AUDACE DULCE X 75ML
20,7798187601020,7,9890.0,No Promo,PURA SOAP BODY MIST LE FLEURS FLORAL X 75ML
