EAN,Producto,Link
7798182770844,"Producto Atophén Fluide. Marca Cepage Descripción: Emulsión fluida Hidratante y reparadora Calma protégé e hidrata Pieles intolerantes. Indicaciones: Atophén Fluide es una emulsión fluida especialmente formulada para pieles intolerantes, sensibles y/o reactivas Calma la piel sensible e irritada aliviando picores e inflamación y la protege de la luz azul y la polución urbana Reduce la sensibilidad y mejora el aspecto general de la piel. Uso: Aplicar Atophén Fluide sobre la piel limpia y seca del rostro, cuello y escote Colocar sobre la piel realizando suaves masajes circulares con la yema de los dedos Para alcanzar efectividad máxima aplicar dos veces al día (mañana y noche). Beneficios: Atophén Fluide está especialmente formulada con una asociación sinérgica de activos hidratantes, calmantes y reparadores para pieles sensibles e intolerantes Vitamina B3 (Niacinamida); Protege a la piel de la luz azul y la polución urbana, reduciendo la sensibilidad de la misma Unifica el tono de la piel y mejora su textura Efecto Anti-stress Vitamina B5 (D Pantenol); Suaviza y calma la piel sensible e irritada y alivia picores, rojeces e inflamación Reparara la barrera cutánea y colabora en la cicatrización Lipomoist™ es un film molecular que asegura ultra hidratación por 24horas Ácido Hialurónico molécula de referencia en hidratación y relleno de pequeñas líneas de expresión Posee además, un alto efecto antioxidante gracias a nuestros exclusivos Polifenoles de UVA Con el uso regular la piel sensible e intolerate estará protegida de agresiones internas y externas, hidratada y confortable. Keywords: hipoalergénica sin fragancia sin parabenos clínica y dermatológicamente testeado cruelty free; piel seca e intolerante; dermocosmética; hidratación; atophén. Presentación Pomo x 50g. Dimensiones 46mm x 40mm x 141mm. Peso 72gr.",
7798182771285,"Producto Atophén Baumé. Marca Cepage Descripción: Bálsamo ultra emoliente Hidrata, nutre y protege Pieles secas y/o con tendencia atópica. Indicaciones: Atophén Baume es un Bálsamo extra rico especialmente formulado para pieles secas, muy secas y/o con tendencia atópica Relipidiza, hidrata y calma Alivia la tirantez, picor, enrojecimiento y resequedad Ayuda a reparar y reforzar la barrera cutánea. Uso: Aplicar Atophén Baume sobre la piel limpia y seca del rostro y/o cuerpo Para alcanzar efectividad máxima aplicar mínimo, dos veces al día. Beneficios: . Keywords: dermatológicamente y bajo control pediátrico; sin fragancia testeado clínica; hipoalergénico sin parabenos; piel seca e intolerante; dermocosmética; hidratación; atophén. Presentación Pomo x 200g.",
7798182771018,"Producto Cicanol Stries. Marca Cepage Descripción: Crema reafirmante Anti-Estrías. Indicaciones: Cicanol Stries es una crema reafirmante y regeneradora Controla y ayuda a prevenir las estrías rosadas. Uso: Aplicar Cicanol Stries dos veces al día con ligeros movimientos circulares sobre las zonas afectadas y a prevenir. Beneficios: Cicanol Stries es una crema para la prevención y cuidado de estrias incipientesSu formula contiene Vitamina A 250000UI: favorece la correcta cicatrización Promueve la elasticidad y suavidad de la piel Estimula la renovación celular Ademas, la asociación de Alantoína, Colágeno y Manteca de Karité regenera, hidrata y alivia la tirantez Posee un alto efecto antioxidante gracias a la asociación de Vitamina E y Polifenoles de UVA La piel se vuelve mas tersa y elástica, consiguiendo así un aspecto saludable. Keywords: hipoalergénica sin parabenos clínica y dermatológicamente testeado cruelty free; dermocosmética; piel dañada; cicanol. Presentación Pomo x 20g.",
7798182770257,"Producto Cicanol QD. Marca Cepage Descripción: Gel reparador epidérmico. Indicaciones: Colabora en la reparación de la piel lesionada, irritada y agrietada. Uso: Aplicar una o dos veces al día, una capa fina sobre el área afectada, limpia y seca Esperar que seque Para un mayor efecto, el área debe estar cubierta las 24horas Se recomienda utilizar durante 60-90días. Beneficios: La fórmula de Cicanol QD está desarrollada para mejorar la apariencia cosmética de la piel, creando un ambioente óptimo para la regeneración de las fibras de colágeno Ayuda a desvanecer las marcas de la piel, como cicatrices y lesiones, gracias a sus exclusivos coponentes, manteniéndola protegida e hidratada Formulado para su uso en adultos, niños y bebés a partir de los 6meses de edad. Keywords: testeado clínica y dermatológicamente y bajo control pediátrico; dermocosmética; hipoalergénico; sin parabenos; no irritante; piel dañada; cicanol. Presentación Pomo cánula x 5g. Dimensiones 30mm x 25mm x 110mm. Peso 25gr.",
7798182770646,"Producto Cicanol QD Spray. Marca Cepage Descripción: Gel de siliconas en aerosol Reparador epidérmico Diseñado para aplicar en cicatrices. Indicaciones: Gel de silicona de fórmula avanzada que ayuda a mejorar la apariencia de cicatrices Colabora en la reparación de la piel lesionada, irritada y agrietada. Uso: Agitar antes de usar Presionar el pico del spray dirigiendo la finísima nube a la zona deseada, manteniendo el envase a 30o 40centímetros de la piel durante unos segundos Aplicar una o dos veces al día, una capa fina sobre el área afectada, limpia y seca Esperar a que seque Para un mayor efecto, el área debe estar cubierta las 24horas Se recomienda utilizar durante 60/90días Su exclusiva válvula permite utilizar el spray de forma normal o invertida (con el pulsador apuntando hacia abajo). Beneficios: Cicanol QD Spray es un gel transparente auto secante formulado especialmente para aplicar en cicatrices; Tales como las producidas en intervenciones quirúrgicas, quemaduras, acné y/o estrías Actúa formando una película hidrorrepelente que aísla la pie de la humedad y de los agentes externos irritantes No obstante, no afecta la respiración normal cutánea Alivia la picazón, el disconfort general de la piel, a la vez que aplana, ablanda y suaviza las cicatrices Su exclusiva válvula permite utilizar el spray de forma normal o invertida garantizando una fácil y práctica aplicación del producto Para evitar la formación de cicatrices queloides, se sugiere utilizar tan pronto se cierre la herida o después de la retirada de suturas; Como complemento de distintos tratamientos dermatológicos. Keywords: testeado clínica y dermatológicamente; dermocosmética; hipoalergénico; sin parabenos; no irritante; piel dañada; cicanol. Presentación Aerosol 75ml. Dimensiones 40mm x 40mm x 170mm. Peso 88gr.",
7798182770240,"Producto Ongles. Marca Cepage Descripción: Fortalecedor ungueal Uñas frágiles y quebradizas. Indicaciones: Fortalecedor para uñas frágiles y quebradizas. Uso: Aplicar diariamente, preferentemente por la noche, sobre las uñas limpias y secas Esperar unos minutos a que el producto se seque, ya que es hidrosoluble Para un resultado óptimo, extender la aplicación durante al menos tres meses. Beneficios: Establece una barrera protectora sobre las agresiones externas que afectan la estructura de las uñas, proporciodo una hidratación intensa, evitando que se sequen y quiebren Su fórmula contiene hierbas ricas en silicatos, esenciales para la remineralización ungueal desde la base De esta forma, la superficie de la uña se vuelve progresivamente menos frágil y más suave Invisible y sin olor Favorece la apariencia y crecimiento de la uña. Keywords: dermocosmética; hipoalergénico; fortalecedora; ongles; uñas. Presentación 4ml. Dimensiones 75mm x 26mm x 80mm. Peso 31gr.",
7798182771032,"Producto Renovateurs Glicólico 0. Marca Cepage Descripción: Sérum renovador de Glicolico al 0% - pH 3,5. Indicaciones: Sérum facial de ácido glicólico al 0% a pH 3,5 Tiene efecto peeling Exfolia la superﬁcie de la piel, ayudando a suavizar su textura y a fomentar el proceso de renovación cutánea. Uso: Aplicar sobre la piel limpia y seca del rostro, cuello y escote por la noche Si la piel nunca utilizó ácidos se puede comenzar con un tratamiento prograsivo y alternado de a 3veces por semana En caso de ardor o irritacion prolongada, espaciar o suspender su uso Utilizar FPS 50+. Beneficios: El ácido glicólico tiene la molécula más pequeña de todos los AHAs (alfa hidroxiácidos) lo que le permite una penetración más profunda y rápida Esta capacidad lo hace más efectivo como exfoliante Su fórmula contiene bisabolol para ayudar a disminuir la irritación, si la hubiera Estimula el proceso de renovación celular cutánea Mejora la hidratación y elasticidad Aporta luminosidad y brillo Unifica el tono y contribuye a difuminar manchas Retexturiza y mejora la superficie de la piel Atenúa arrugas y líneas de expresión. Keywords: hipoalergénica sin parabenos clínica y dermatológicamente testeado cruelty free; renovación celular; dermocosmética; renovateurs; ácidos. Presentación Gotero 30ml.",
7798182771056,"Producto Renovateurs Mandélico 0. Marca Cepage Descripción: Sérum renovador de Mandélico al 0% - pH 3,5. Indicaciones: Sérum facial de ácido mandélico al 0% a pH 3,5 Tiene efecto peeling Exfolia la superﬁcie de la piel, ayudando a suavizar su textura y a fomentar el proceso de renovación cutánea Ideal para pieles sensibles y con tendencia al acné. Uso: Aplicar sobre la piel limpia y seca del rostro, cuello y escote por la noche Si la piel nunca utilizó ácidos se puede comenzar con un tratamiento progresivo y alternado de a 3veces por semana En caso de ardor o irritacion prolongada, espaciar o suspender su uso Utilizar FPS 50+. Beneficios: El ácido mandélico tiene la molécula más grande de todos los AHAs (alfa hidroxiácidos) lo que le permite una penetración más lenta en la piel Esta capacidad lo hace más adecuado para pieles sensibles Su fórmula contiene bisabolol para ayudar a disminuir la irritación, si la hubiera Estimula el proceso de renovación celular cutánea Unifica el tono y contribuye a atenuar manchas Mejora y previene el acné Retexturiza y mejora la superficie de la piel Reduce las líneas de expresión. Keywords: hipoalergénica sin parabenos clínica y dermatológicamente testeado cruelty free; renovación celular; dermocosmética; renovateurs; ácidos. Presentación Gotero 30ml.",
7798182771209,"Producto Renovateurs Glicólico 5. Marca Cepage Descripción: Crema renovadora de Glicólico al 5% - pH 3,5. Indicaciones: Crema facial de ácido glicólico al 5% a pH 3,5 Tiene efecto peeling Exfolia e hidrata la superﬁcie de la piel, ayudando a suavizar su textura y a fomentar el proceso de renovación cutánea. Uso: Aplicar sobre la piel limpia y seca del rostro, cuello y escote por la noche Si la piel nunca utilizó ácidos se puede comenzar con un tratamiento progresivo y alternado de a 3veces por semana En caso de ardor o irritacion prolongada, espaciar o suspender su uso Utilizar FPS 50+. Beneficios: Renovateurs Glicólico 5es una crema facial, formulada con un 5% de ácido glicólico (pH 3,5) El ácido glicólico tiene la molécula más pequeña de todos los AHAs (alfa hidroxiácidos) lo que le permite una penetración más profunda y rápida Esta capacidad lo hace más efectivo como exfoliante Su concentración moderada al 5% y la asociación con Lipomoist™ le confieren un alto poder hidratante Su fórmula contiene, además, bisabolol para ayudar a disminuir la irritación, si la hubiera Estimula el proceso de renovación celular cutánea Hidrata y mejora la elasticidad Aporta luminosidad y brillo Unifica el tono y contribuye a difuminar manchas Retexturiza y mejora la superficie de la piel Atenúa arrugas y líneas de expresión. Keywords: sin fragancia clínica y dermatológicamente testeado; renovación celular; dermocosmética; renovateurs; ácidos. Presentación Frasco 50g.",
